{
	"other1": "https://docs.google.com/spreadsheets/d/e/2PACX-1vRXFDCCxRtPaYyEcKtX7TwPuWEYkvVrHvbpvCvBZ2E5ALt9KHWII9OAb3ddYRIl005w7P3gUWi99fbG/pubhtml",
	"other2": "https://spreadsheets.google.com/feeds/cells/YOURGOOGLESHEETCODE/SHEETPAGENUMBER/public/full?alt=json",
	"other3": "https://docs.google.com/spreadsheets/d/1svNxbDR3mKKmLCdcTmMmj2XaI2bl-bA-cSOVQOO_zaM/edit#gid=0",
	"other4": "https://spreadsheets.google.com/feeds/cells/1svNxbDR3mKKmLCdcTmMmj2XaI2bl-bA-cSOVQOO_zaM/1/public/full?alt=json",

	"version": "1.0",
	"encoding": "UTF-8",
	"feed": {
		"xmlns": "http://www.w3.org/2005/Atom",
		"xmlns$openSearch": "http://a9.com/-/spec/opensearchrss/1.0/",
		"xmlns$batch": "http://schemas.google.com/gdata/batch",
		"xmlns$gs": "http://schemas.google.com/spreadsheets/2006",
		"id": {
			"$t": "https://spreadsheets.google.com/feeds/cells/1svNxbDR3mKKmLCdcTmMmj2XaI2bl-bA-cSOVQOO_zaM/1/public/full"
		},
		"updated": {
			"$t": "2020-05-13T13:59:08.728Z"
		},
		"category": [{
			"scheme": "http://schemas.google.com/spreadsheets/2006",
			"term": "http://schemas.google.com/spreadsheets/2006#cell"
		}],
		"title": {
			"type": "text",
			"$t": "deliverables"
		},
		"link": [{
			"rel": "alternate",
			"type": "application/atom+xml",
			"href": "https://docs.google.com/spreadsheets/u/0/d/1svNxbDR3mKKmLCdcTmMmj2XaI2bl-bA-cSOVQOO_zaM/pubhtml"
		}, {
			"rel": "http://schemas.google.com/g/2005#feed",
			"type": "application/atom+xml",
			"href": "https://spreadsheets.google.com/feeds/cells/1svNxbDR3mKKmLCdcTmMmj2XaI2bl-bA-cSOVQOO_zaM/1/public/full"
		}, {
			"rel": "http://schemas.google.com/g/2005#post",
			"type": "application/atom+xml",
			"href": "https://spreadsheets.google.com/feeds/cells/1svNxbDR3mKKmLCdcTmMmj2XaI2bl-bA-cSOVQOO_zaM/1/public/full"
		}, {
			"rel": "http://schemas.google.com/g/2005#batch",
			"type": "application/atom+xml",
			"href": "https://spreadsheets.google.com/feeds/cells/1svNxbDR3mKKmLCdcTmMmj2XaI2bl-bA-cSOVQOO_zaM/1/public/full/batch"
		}, {
			"rel": "self",
			"type": "application/atom+xml",
			"href": "https://spreadsheets.google.com/feeds/cells/1svNxbDR3mKKmLCdcTmMmj2XaI2bl-bA-cSOVQOO_zaM/1/public/full?alt\u003djson"
		}],
		"author": [{
			"name": {
				"$t": "antonio.borba"
			},
			"email": {
				"$t": "antonio.borba@tecnico.ulisboa.pt"
			}
		}],
		"openSearch$totalResults": {
			"$t": "230"
		},
		"openSearch$startIndex": {
			"$t": "1"
		},
		"gs$rowCount": {
			"$t": "997"
		},
		"gs$colCount": {
			"$t": "26"
		},
		"entry": [{
			"id": {
				"$t": "https://spreadsheets.google.com/feeds/cells/1svNxbDR3mKKmLCdcTmMmj2XaI2bl-bA-cSOVQOO_zaM/1/public/full/R1C1"
			},
			"updated": {
				"$t": "2020-05-13T13:59:08.728Z"
			},
			"category": [{
				"scheme": "http://schemas.google.com/spreadsheets/2006",
				"term": "http://schemas.google.com/spreadsheets/2006#cell"
			}],
			"title": {
				"type": "text",
				"$t": "A1"
			},
			"content": {
				"type": "text",
				"$t": "uc"
			},
			"link": [{
				"rel": "self",
				"type": "application/atom+xml",
				"href": "https://spreadsheets.google.com/feeds/cells/1svNxbDR3mKKmLCdcTmMmj2XaI2bl-bA-cSOVQOO_zaM/1/public/full/R1C1"
			}],
			"gs$cell": {
				"row": "1",
				"col": "1",
				"inputValue": "uc",
				"$t": "uc"
			}
		}, {
			"id": {
				"$t": "https://spreadsheets.google.com/feeds/cells/1svNxbDR3mKKmLCdcTmMmj2XaI2bl-bA-cSOVQOO_zaM/1/public/full/R1C2"
			},
			"updated": {
				"$t": "2020-05-13T13:59:08.728Z"
			},
			"category": [{
				"scheme": "http://schemas.google.com/spreadsheets/2006",
				"term": "http://schemas.google.com/spreadsheets/2006#cell"
			}],
			"title": {
				"type": "text",
				"$t": "B1"
			},
			"content": {
				"type": "text",
				"$t": "deliverable"
			},
			"link": [{
				"rel": "self",
				"type": "application/atom+xml",
				"href": "https://spreadsheets.google.com/feeds/cells/1svNxbDR3mKKmLCdcTmMmj2XaI2bl-bA-cSOVQOO_zaM/1/public/full/R1C2"
			}],
			"gs$cell": {
				"row": "1",
				"col": "2",
				"inputValue": "deliverable",
				"$t": "deliverable"
			}
		}, {
			"id": {
				"$t": "https://spreadsheets.google.com/feeds/cells/1svNxbDR3mKKmLCdcTmMmj2XaI2bl-bA-cSOVQOO_zaM/1/public/full/R1C3"
			},
			"updated": {
				"$t": "2020-05-13T13:59:08.728Z"
			},
			"category": [{
				"scheme": "http://schemas.google.com/spreadsheets/2006",
				"term": "http://schemas.google.com/spreadsheets/2006#cell"
			}],
			"title": {
				"type": "text",
				"$t": "C1"
			},
			"content": {
				"type": "text",
				"$t": "type"
			},
			"link": [{
				"rel": "self",
				"type": "application/atom+xml",
				"href": "https://spreadsheets.google.com/feeds/cells/1svNxbDR3mKKmLCdcTmMmj2XaI2bl-bA-cSOVQOO_zaM/1/public/full/R1C3"
			}],
			"gs$cell": {
				"row": "1",
				"col": "3",
				"inputValue": "type",
				"$t": "type"
			}
		}, {
			"id": {
				"$t": "https://spreadsheets.google.com/feeds/cells/1svNxbDR3mKKmLCdcTmMmj2XaI2bl-bA-cSOVQOO_zaM/1/public/full/R1C4"
			},
			"updated": {
				"$t": "2020-05-13T13:59:08.728Z"
			},
			"category": [{
				"scheme": "http://schemas.google.com/spreadsheets/2006",
				"term": "http://schemas.google.com/spreadsheets/2006#cell"
			}],
			"title": {
				"type": "text",
				"$t": "D1"
			},
			"content": {
				"type": "text",
				"$t": "href"
			},
			"link": [{
				"rel": "self",
				"type": "application/atom+xml",
				"href": "https://spreadsheets.google.com/feeds/cells/1svNxbDR3mKKmLCdcTmMmj2XaI2bl-bA-cSOVQOO_zaM/1/public/full/R1C4"
			}],
			"gs$cell": {
				"row": "1",
				"col": "4",
				"inputValue": "href",
				"$t": "href"
			}
		}, {
			"id": {
				"$t": "https://spreadsheets.google.com/feeds/cells/1svNxbDR3mKKmLCdcTmMmj2XaI2bl-bA-cSOVQOO_zaM/1/public/full/R1C5"
			},
			"updated": {
				"$t": "2020-05-13T13:59:08.728Z"
			},
			"category": [{
				"scheme": "http://schemas.google.com/spreadsheets/2006",
				"term": "http://schemas.google.com/spreadsheets/2006#cell"
			}],
			"title": {
				"type": "text",
				"$t": "E1"
			},
			"content": {
				"type": "text",
				"$t": "startDate"
			},
			"link": [{
				"rel": "self",
				"type": "application/atom+xml",
				"href": "https://spreadsheets.google.com/feeds/cells/1svNxbDR3mKKmLCdcTmMmj2XaI2bl-bA-cSOVQOO_zaM/1/public/full/R1C5"
			}],
			"gs$cell": {
				"row": "1",
				"col": "5",
				"inputValue": "startDate",
				"$t": "startDate"
			}
		}, {
			"id": {
				"$t": "https://spreadsheets.google.com/feeds/cells/1svNxbDR3mKKmLCdcTmMmj2XaI2bl-bA-cSOVQOO_zaM/1/public/full/R1C6"
			},
			"updated": {
				"$t": "2020-05-13T13:59:08.728Z"
			},
			"category": [{
				"scheme": "http://schemas.google.com/spreadsheets/2006",
				"term": "http://schemas.google.com/spreadsheets/2006#cell"
			}],
			"title": {
				"type": "text",
				"$t": "F1"
			},
			"content": {
				"type": "text",
				"$t": "dueDate"
			},
			"link": [{
				"rel": "self",
				"type": "application/atom+xml",
				"href": "https://spreadsheets.google.com/feeds/cells/1svNxbDR3mKKmLCdcTmMmj2XaI2bl-bA-cSOVQOO_zaM/1/public/full/R1C6"
			}],
			"gs$cell": {
				"row": "1",
				"col": "6",
				"inputValue": "dueDate",
				"$t": "dueDate"
			}
		}, {
			"id": {
				"$t": "https://spreadsheets.google.com/feeds/cells/1svNxbDR3mKKmLCdcTmMmj2XaI2bl-bA-cSOVQOO_zaM/1/public/full/R2C1"
			},
			"updated": {
				"$t": "2020-05-13T13:59:08.728Z"
			},
			"category": [{
				"scheme": "http://schemas.google.com/spreadsheets/2006",
				"term": "http://schemas.google.com/spreadsheets/2006#cell"
			}],
			"title": {
				"type": "text",
				"$t": "A2"
			},
			"content": {
				"type": "text",
				"$t": "EA"
			},
			"link": [{
				"rel": "self",
				"type": "application/atom+xml",
				"href": "https://spreadsheets.google.com/feeds/cells/1svNxbDR3mKKmLCdcTmMmj2XaI2bl-bA-cSOVQOO_zaM/1/public/full/R2C1"
			}],
			"gs$cell": {
				"row": "2",
				"col": "1",
				"inputValue": "EA",
				"$t": "EA"
			}
		}, {
			"id": {
				"$t": "https://spreadsheets.google.com/feeds/cells/1svNxbDR3mKKmLCdcTmMmj2XaI2bl-bA-cSOVQOO_zaM/1/public/full/R2C2"
			},
			"updated": {
				"$t": "2020-05-13T13:59:08.728Z"
			},
			"category": [{
				"scheme": "http://schemas.google.com/spreadsheets/2006",
				"term": "http://schemas.google.com/spreadsheets/2006#cell"
			}],
			"title": {
				"type": "text",
				"$t": "B2"
			},
			"content": {
				"type": "text",
				"$t": "Homework Bonus #01"
			},
			"link": [{
				"rel": "self",
				"type": "application/atom+xml",
				"href": "https://spreadsheets.google.com/feeds/cells/1svNxbDR3mKKmLCdcTmMmj2XaI2bl-bA-cSOVQOO_zaM/1/public/full/R2C2"
			}],
			"gs$cell": {
				"row": "2",
				"col": "2",
				"inputValue": "Homework Bonus #01",
				"$t": "Homework Bonus #01"
			}
		}, {
			"id": {
				"$t": "https://spreadsheets.google.com/feeds/cells/1svNxbDR3mKKmLCdcTmMmj2XaI2bl-bA-cSOVQOO_zaM/1/public/full/R2C3"
			},
			"updated": {
				"$t": "2020-05-13T13:59:08.728Z"
			},
			"category": [{
				"scheme": "http://schemas.google.com/spreadsheets/2006",
				"term": "http://schemas.google.com/spreadsheets/2006#cell"
			}],
			"title": {
				"type": "text",
				"$t": "C2"
			},
			"content": {
				"type": "text",
				"$t": "homework"
			},
			"link": [{
				"rel": "self",
				"type": "application/atom+xml",
				"href": "https://spreadsheets.google.com/feeds/cells/1svNxbDR3mKKmLCdcTmMmj2XaI2bl-bA-cSOVQOO_zaM/1/public/full/R2C3"
			}],
			"gs$cell": {
				"row": "2",
				"col": "3",
				"inputValue": "homework",
				"$t": "homework"
			}
		}, {
			"id": {
				"$t": "https://spreadsheets.google.com/feeds/cells/1svNxbDR3mKKmLCdcTmMmj2XaI2bl-bA-cSOVQOO_zaM/1/public/full/R2C4"
			},
			"updated": {
				"$t": "2020-05-13T13:59:08.728Z"
			},
			"category": [{
				"scheme": "http://schemas.google.com/spreadsheets/2006",
				"term": "http://schemas.google.com/spreadsheets/2006#cell"
			}],
			"title": {
				"type": "text",
				"$t": "D2"
			},
			"content": {
				"type": "text",
				"$t": "https://ulisboa-my.sharepoint.com/:f:/r/personal/ist197096_tecnico_ulisboa_pt/Documents/EA/homework/ps%2301_2020_03_01?csf\u003d1\u0026web\u003d1\u0026e\u003dk1nymd"
			},
			"link": [{
				"rel": "self",
				"type": "application/atom+xml",
				"href": "https://spreadsheets.google.com/feeds/cells/1svNxbDR3mKKmLCdcTmMmj2XaI2bl-bA-cSOVQOO_zaM/1/public/full/R2C4"
			}],
			"gs$cell": {
				"row": "2",
				"col": "4",
				"inputValue": "https://ulisboa-my.sharepoint.com/:f:/r/personal/ist197096_tecnico_ulisboa_pt/Documents/EA/homework/ps%2301_2020_03_01?csf\u003d1\u0026web\u003d1\u0026e\u003dk1nymd",
				"$t": "https://ulisboa-my.sharepoint.com/:f:/r/personal/ist197096_tecnico_ulisboa_pt/Documents/EA/homework/ps%2301_2020_03_01?csf\u003d1\u0026web\u003d1\u0026e\u003dk1nymd"
			}
		}, {
			"id": {
				"$t": "https://spreadsheets.google.com/feeds/cells/1svNxbDR3mKKmLCdcTmMmj2XaI2bl-bA-cSOVQOO_zaM/1/public/full/R2C5"
			},
			"updated": {
				"$t": "2020-05-13T13:59:08.728Z"
			},
			"category": [{
				"scheme": "http://schemas.google.com/spreadsheets/2006",
				"term": "http://schemas.google.com/spreadsheets/2006#cell"
			}],
			"title": {
				"type": "text",
				"$t": "E2"
			},
			"content": {
				"type": "text",
				"$t": "2020/02/19 0:01"
			},
			"link": [{
				"rel": "self",
				"type": "application/atom+xml",
				"href": "https://spreadsheets.google.com/feeds/cells/1svNxbDR3mKKmLCdcTmMmj2XaI2bl-bA-cSOVQOO_zaM/1/public/full/R2C5"
			}],
			"gs$cell": {
				"row": "2",
				"col": "5",
				"inputValue": "2/19/2020 0:01:00",
				"numericValue": "43880.00069444445",
				"$t": "2020/02/19 0:01"
			}
		}, {
			"id": {
				"$t": "https://spreadsheets.google.com/feeds/cells/1svNxbDR3mKKmLCdcTmMmj2XaI2bl-bA-cSOVQOO_zaM/1/public/full/R2C6"
			},
			"updated": {
				"$t": "2020-05-13T13:59:08.728Z"
			},
			"category": [{
				"scheme": "http://schemas.google.com/spreadsheets/2006",
				"term": "http://schemas.google.com/spreadsheets/2006#cell"
			}],
			"title": {
				"type": "text",
				"$t": "F2"
			},
			"content": {
				"type": "text",
				"$t": "2020/03/01 23:59"
			},
			"link": [{
				"rel": "self",
				"type": "application/atom+xml",
				"href": "https://spreadsheets.google.com/feeds/cells/1svNxbDR3mKKmLCdcTmMmj2XaI2bl-bA-cSOVQOO_zaM/1/public/full/R2C6"
			}],
			"gs$cell": {
				"row": "2",
				"col": "6",
				"inputValue": "3/1/2020 23:59:00",
				"numericValue": "43891.99930555555",
				"$t": "2020/03/01 23:59"
			}
		}, {
			"id": {
				"$t": "https://spreadsheets.google.com/feeds/cells/1svNxbDR3mKKmLCdcTmMmj2XaI2bl-bA-cSOVQOO_zaM/1/public/full/R3C1"
			},
			"updated": {
				"$t": "2020-05-13T13:59:08.728Z"
			},
			"category": [{
				"scheme": "http://schemas.google.com/spreadsheets/2006",
				"term": "http://schemas.google.com/spreadsheets/2006#cell"
			}],
			"title": {
				"type": "text",
				"$t": "A3"
			},
			"content": {
				"type": "text",
				"$t": "EA"
			},
			"link": [{
				"rel": "self",
				"type": "application/atom+xml",
				"href": "https://spreadsheets.google.com/feeds/cells/1svNxbDR3mKKmLCdcTmMmj2XaI2bl-bA-cSOVQOO_zaM/1/public/full/R3C1"
			}],
			"gs$cell": {
				"row": "3",
				"col": "1",
				"inputValue": "EA",
				"$t": "EA"
			}
		}, {
			"id": {
				"$t": "https://spreadsheets.google.com/feeds/cells/1svNxbDR3mKKmLCdcTmMmj2XaI2bl-bA-cSOVQOO_zaM/1/public/full/R3C2"
			},
			"updated": {
				"$t": "2020-05-13T13:59:08.728Z"
			},
			"category": [{
				"scheme": "http://schemas.google.com/spreadsheets/2006",
				"term": "http://schemas.google.com/spreadsheets/2006#cell"
			}],
			"title": {
				"type": "text",
				"$t": "B3"
			},
			"content": {
				"type": "text",
				"$t": "Homework Bonus #02"
			},
			"link": [{
				"rel": "self",
				"type": "application/atom+xml",
				"href": "https://spreadsheets.google.com/feeds/cells/1svNxbDR3mKKmLCdcTmMmj2XaI2bl-bA-cSOVQOO_zaM/1/public/full/R3C2"
			}],
			"gs$cell": {
				"row": "3",
				"col": "2",
				"inputValue": "Homework Bonus #02",
				"$t": "Homework Bonus #02"
			}
		}, {
			"id": {
				"$t": "https://spreadsheets.google.com/feeds/cells/1svNxbDR3mKKmLCdcTmMmj2XaI2bl-bA-cSOVQOO_zaM/1/public/full/R3C3"
			},
			"updated": {
				"$t": "2020-05-13T13:59:08.728Z"
			},
			"category": [{
				"scheme": "http://schemas.google.com/spreadsheets/2006",
				"term": "http://schemas.google.com/spreadsheets/2006#cell"
			}],
			"title": {
				"type": "text",
				"$t": "C3"
			},
			"content": {
				"type": "text",
				"$t": "homework"
			},
			"link": [{
				"rel": "self",
				"type": "application/atom+xml",
				"href": "https://spreadsheets.google.com/feeds/cells/1svNxbDR3mKKmLCdcTmMmj2XaI2bl-bA-cSOVQOO_zaM/1/public/full/R3C3"
			}],
			"gs$cell": {
				"row": "3",
				"col": "3",
				"inputValue": "homework",
				"$t": "homework"
			}
		}, {
			"id": {
				"$t": "https://spreadsheets.google.com/feeds/cells/1svNxbDR3mKKmLCdcTmMmj2XaI2bl-bA-cSOVQOO_zaM/1/public/full/R3C4"
			},
			"updated": {
				"$t": "2020-05-13T13:59:08.728Z"
			},
			"category": [{
				"scheme": "http://schemas.google.com/spreadsheets/2006",
				"term": "http://schemas.google.com/spreadsheets/2006#cell"
			}],
			"title": {
				"type": "text",
				"$t": "D3"
			},
			"content": {
				"type": "text",
				"$t": "https://ulisboa-my.sharepoint.com/:f:/r/personal/ist197096_tecnico_ulisboa_pt/Documents/EA/homework/ps%2302_2020_03_08?csf\u003d1\u0026web\u003d1\u0026e\u003dFc0T2i"
			},
			"link": [{
				"rel": "self",
				"type": "application/atom+xml",
				"href": "https://spreadsheets.google.com/feeds/cells/1svNxbDR3mKKmLCdcTmMmj2XaI2bl-bA-cSOVQOO_zaM/1/public/full/R3C4"
			}],
			"gs$cell": {
				"row": "3",
				"col": "4",
				"inputValue": "https://ulisboa-my.sharepoint.com/:f:/r/personal/ist197096_tecnico_ulisboa_pt/Documents/EA/homework/ps%2302_2020_03_08?csf\u003d1\u0026web\u003d1\u0026e\u003dFc0T2i",
				"$t": "https://ulisboa-my.sharepoint.com/:f:/r/personal/ist197096_tecnico_ulisboa_pt/Documents/EA/homework/ps%2302_2020_03_08?csf\u003d1\u0026web\u003d1\u0026e\u003dFc0T2i"
			}
		}, {
			"id": {
				"$t": "https://spreadsheets.google.com/feeds/cells/1svNxbDR3mKKmLCdcTmMmj2XaI2bl-bA-cSOVQOO_zaM/1/public/full/R3C5"
			},
			"updated": {
				"$t": "2020-05-13T13:59:08.728Z"
			},
			"category": [{
				"scheme": "http://schemas.google.com/spreadsheets/2006",
				"term": "http://schemas.google.com/spreadsheets/2006#cell"
			}],
			"title": {
				"type": "text",
				"$t": "E3"
			},
			"content": {
				"type": "text",
				"$t": "2020/03/03 0:01"
			},
			"link": [{
				"rel": "self",
				"type": "application/atom+xml",
				"href": "https://spreadsheets.google.com/feeds/cells/1svNxbDR3mKKmLCdcTmMmj2XaI2bl-bA-cSOVQOO_zaM/1/public/full/R3C5"
			}],
			"gs$cell": {
				"row": "3",
				"col": "5",
				"inputValue": "3/3/2020 0:01:00",
				"numericValue": "43893.00069444445",
				"$t": "2020/03/03 0:01"
			}
		}, {
			"id": {
				"$t": "https://spreadsheets.google.com/feeds/cells/1svNxbDR3mKKmLCdcTmMmj2XaI2bl-bA-cSOVQOO_zaM/1/public/full/R3C6"
			},
			"updated": {
				"$t": "2020-05-13T13:59:08.728Z"
			},
			"category": [{
				"scheme": "http://schemas.google.com/spreadsheets/2006",
				"term": "http://schemas.google.com/spreadsheets/2006#cell"
			}],
			"title": {
				"type": "text",
				"$t": "F3"
			},
			"content": {
				"type": "text",
				"$t": "2020/03/08 23:59"
			},
			"link": [{
				"rel": "self",
				"type": "application/atom+xml",
				"href": "https://spreadsheets.google.com/feeds/cells/1svNxbDR3mKKmLCdcTmMmj2XaI2bl-bA-cSOVQOO_zaM/1/public/full/R3C6"
			}],
			"gs$cell": {
				"row": "3",
				"col": "6",
				"inputValue": "3/8/2020 23:59:00",
				"numericValue": "43898.99930555555",
				"$t": "2020/03/08 23:59"
			}
		}, {
			"id": {
				"$t": "https://spreadsheets.google.com/feeds/cells/1svNxbDR3mKKmLCdcTmMmj2XaI2bl-bA-cSOVQOO_zaM/1/public/full/R4C1"
			},
			"updated": {
				"$t": "2020-05-13T13:59:08.728Z"
			},
			"category": [{
				"scheme": "http://schemas.google.com/spreadsheets/2006",
				"term": "http://schemas.google.com/spreadsheets/2006#cell"
			}],
			"title": {
				"type": "text",
				"$t": "A4"
			},
			"content": {
				"type": "text",
				"$t": "EA"
			},
			"link": [{
				"rel": "self",
				"type": "application/atom+xml",
				"href": "https://spreadsheets.google.com/feeds/cells/1svNxbDR3mKKmLCdcTmMmj2XaI2bl-bA-cSOVQOO_zaM/1/public/full/R4C1"
			}],
			"gs$cell": {
				"row": "4",
				"col": "1",
				"inputValue": "EA",
				"$t": "EA"
			}
		}, {
			"id": {
				"$t": "https://spreadsheets.google.com/feeds/cells/1svNxbDR3mKKmLCdcTmMmj2XaI2bl-bA-cSOVQOO_zaM/1/public/full/R4C2"
			},
			"updated": {
				"$t": "2020-05-13T13:59:08.728Z"
			},
			"category": [{
				"scheme": "http://schemas.google.com/spreadsheets/2006",
				"term": "http://schemas.google.com/spreadsheets/2006#cell"
			}],
			"title": {
				"type": "text",
				"$t": "B4"
			},
			"content": {
				"type": "text",
				"$t": "Homework Bonus #03"
			},
			"link": [{
				"rel": "self",
				"type": "application/atom+xml",
				"href": "https://spreadsheets.google.com/feeds/cells/1svNxbDR3mKKmLCdcTmMmj2XaI2bl-bA-cSOVQOO_zaM/1/public/full/R4C2"
			}],
			"gs$cell": {
				"row": "4",
				"col": "2",
				"inputValue": "Homework Bonus #03",
				"$t": "Homework Bonus #03"
			}
		}, {
			"id": {
				"$t": "https://spreadsheets.google.com/feeds/cells/1svNxbDR3mKKmLCdcTmMmj2XaI2bl-bA-cSOVQOO_zaM/1/public/full/R4C3"
			},
			"updated": {
				"$t": "2020-05-13T13:59:08.728Z"
			},
			"category": [{
				"scheme": "http://schemas.google.com/spreadsheets/2006",
				"term": "http://schemas.google.com/spreadsheets/2006#cell"
			}],
			"title": {
				"type": "text",
				"$t": "C4"
			},
			"content": {
				"type": "text",
				"$t": "homework"
			},
			"link": [{
				"rel": "self",
				"type": "application/atom+xml",
				"href": "https://spreadsheets.google.com/feeds/cells/1svNxbDR3mKKmLCdcTmMmj2XaI2bl-bA-cSOVQOO_zaM/1/public/full/R4C3"
			}],
			"gs$cell": {
				"row": "4",
				"col": "3",
				"inputValue": "homework",
				"$t": "homework"
			}
		}, {
			"id": {
				"$t": "https://spreadsheets.google.com/feeds/cells/1svNxbDR3mKKmLCdcTmMmj2XaI2bl-bA-cSOVQOO_zaM/1/public/full/R4C4"
			},
			"updated": {
				"$t": "2020-05-13T13:59:08.728Z"
			},
			"category": [{
				"scheme": "http://schemas.google.com/spreadsheets/2006",
				"term": "http://schemas.google.com/spreadsheets/2006#cell"
			}],
			"title": {
				"type": "text",
				"$t": "D4"
			},
			"content": {
				"type": "text",
				"$t": "https://ulisboa-my.sharepoint.com/:f:/r/personal/ist197096_tecnico_ulisboa_pt/Documents/EA/homework/ps%2303_2020_03_15?csf\u003d1\u0026web\u003d1\u0026e\u003dMuFhxl"
			},
			"link": [{
				"rel": "self",
				"type": "application/atom+xml",
				"href": "https://spreadsheets.google.com/feeds/cells/1svNxbDR3mKKmLCdcTmMmj2XaI2bl-bA-cSOVQOO_zaM/1/public/full/R4C4"
			}],
			"gs$cell": {
				"row": "4",
				"col": "4",
				"inputValue": "https://ulisboa-my.sharepoint.com/:f:/r/personal/ist197096_tecnico_ulisboa_pt/Documents/EA/homework/ps%2303_2020_03_15?csf\u003d1\u0026web\u003d1\u0026e\u003dMuFhxl",
				"$t": "https://ulisboa-my.sharepoint.com/:f:/r/personal/ist197096_tecnico_ulisboa_pt/Documents/EA/homework/ps%2303_2020_03_15?csf\u003d1\u0026web\u003d1\u0026e\u003dMuFhxl"
			}
		}, {
			"id": {
				"$t": "https://spreadsheets.google.com/feeds/cells/1svNxbDR3mKKmLCdcTmMmj2XaI2bl-bA-cSOVQOO_zaM/1/public/full/R4C5"
			},
			"updated": {
				"$t": "2020-05-13T13:59:08.728Z"
			},
			"category": [{
				"scheme": "http://schemas.google.com/spreadsheets/2006",
				"term": "http://schemas.google.com/spreadsheets/2006#cell"
			}],
			"title": {
				"type": "text",
				"$t": "E4"
			},
			"content": {
				"type": "text",
				"$t": "2020/03/11 0:01"
			},
			"link": [{
				"rel": "self",
				"type": "application/atom+xml",
				"href": "https://spreadsheets.google.com/feeds/cells/1svNxbDR3mKKmLCdcTmMmj2XaI2bl-bA-cSOVQOO_zaM/1/public/full/R4C5"
			}],
			"gs$cell": {
				"row": "4",
				"col": "5",
				"inputValue": "3/11/2020 0:01:00",
				"numericValue": "43901.00069444445",
				"$t": "2020/03/11 0:01"
			}
		}, {
			"id": {
				"$t": "https://spreadsheets.google.com/feeds/cells/1svNxbDR3mKKmLCdcTmMmj2XaI2bl-bA-cSOVQOO_zaM/1/public/full/R4C6"
			},
			"updated": {
				"$t": "2020-05-13T13:59:08.728Z"
			},
			"category": [{
				"scheme": "http://schemas.google.com/spreadsheets/2006",
				"term": "http://schemas.google.com/spreadsheets/2006#cell"
			}],
			"title": {
				"type": "text",
				"$t": "F4"
			},
			"content": {
				"type": "text",
				"$t": "2020/03/15 23:59"
			},
			"link": [{
				"rel": "self",
				"type": "application/atom+xml",
				"href": "https://spreadsheets.google.com/feeds/cells/1svNxbDR3mKKmLCdcTmMmj2XaI2bl-bA-cSOVQOO_zaM/1/public/full/R4C6"
			}],
			"gs$cell": {
				"row": "4",
				"col": "6",
				"inputValue": "3/15/2020 23:59:00",
				"numericValue": "43905.99930555555",
				"$t": "2020/03/15 23:59"
			}
		}, {
			"id": {
				"$t": "https://spreadsheets.google.com/feeds/cells/1svNxbDR3mKKmLCdcTmMmj2XaI2bl-bA-cSOVQOO_zaM/1/public/full/R5C1"
			},
			"updated": {
				"$t": "2020-05-13T13:59:08.728Z"
			},
			"category": [{
				"scheme": "http://schemas.google.com/spreadsheets/2006",
				"term": "http://schemas.google.com/spreadsheets/2006#cell"
			}],
			"title": {
				"type": "text",
				"$t": "A5"
			},
			"content": {
				"type": "text",
				"$t": "EA"
			},
			"link": [{
				"rel": "self",
				"type": "application/atom+xml",
				"href": "https://spreadsheets.google.com/feeds/cells/1svNxbDR3mKKmLCdcTmMmj2XaI2bl-bA-cSOVQOO_zaM/1/public/full/R5C1"
			}],
			"gs$cell": {
				"row": "5",
				"col": "1",
				"inputValue": "EA",
				"$t": "EA"
			}
		}, {
			"id": {
				"$t": "https://spreadsheets.google.com/feeds/cells/1svNxbDR3mKKmLCdcTmMmj2XaI2bl-bA-cSOVQOO_zaM/1/public/full/R5C2"
			},
			"updated": {
				"$t": "2020-05-13T13:59:08.728Z"
			},
			"category": [{
				"scheme": "http://schemas.google.com/spreadsheets/2006",
				"term": "http://schemas.google.com/spreadsheets/2006#cell"
			}],
			"title": {
				"type": "text",
				"$t": "B5"
			},
			"content": {
				"type": "text",
				"$t": "Homework Bonus #04"
			},
			"link": [{
				"rel": "self",
				"type": "application/atom+xml",
				"href": "https://spreadsheets.google.com/feeds/cells/1svNxbDR3mKKmLCdcTmMmj2XaI2bl-bA-cSOVQOO_zaM/1/public/full/R5C2"
			}],
			"gs$cell": {
				"row": "5",
				"col": "2",
				"inputValue": "Homework Bonus #04",
				"$t": "Homework Bonus #04"
			}
		}, {
			"id": {
				"$t": "https://spreadsheets.google.com/feeds/cells/1svNxbDR3mKKmLCdcTmMmj2XaI2bl-bA-cSOVQOO_zaM/1/public/full/R5C3"
			},
			"updated": {
				"$t": "2020-05-13T13:59:08.728Z"
			},
			"category": [{
				"scheme": "http://schemas.google.com/spreadsheets/2006",
				"term": "http://schemas.google.com/spreadsheets/2006#cell"
			}],
			"title": {
				"type": "text",
				"$t": "C5"
			},
			"content": {
				"type": "text",
				"$t": "homework"
			},
			"link": [{
				"rel": "self",
				"type": "application/atom+xml",
				"href": "https://spreadsheets.google.com/feeds/cells/1svNxbDR3mKKmLCdcTmMmj2XaI2bl-bA-cSOVQOO_zaM/1/public/full/R5C3"
			}],
			"gs$cell": {
				"row": "5",
				"col": "3",
				"inputValue": "homework",
				"$t": "homework"
			}
		}, {
			"id": {
				"$t": "https://spreadsheets.google.com/feeds/cells/1svNxbDR3mKKmLCdcTmMmj2XaI2bl-bA-cSOVQOO_zaM/1/public/full/R5C4"
			},
			"updated": {
				"$t": "2020-05-13T13:59:08.728Z"
			},
			"category": [{
				"scheme": "http://schemas.google.com/spreadsheets/2006",
				"term": "http://schemas.google.com/spreadsheets/2006#cell"
			}],
			"title": {
				"type": "text",
				"$t": "D5"
			},
			"content": {
				"type": "text",
				"$t": "https://ulisboa-my.sharepoint.com/:f:/r/personal/ist197096_tecnico_ulisboa_pt/Documents/EA/homework/ps%2304_2020_03_22?csf\u003d1\u0026web\u003d1\u0026e\u003dkeuPaD"
			},
			"link": [{
				"rel": "self",
				"type": "application/atom+xml",
				"href": "https://spreadsheets.google.com/feeds/cells/1svNxbDR3mKKmLCdcTmMmj2XaI2bl-bA-cSOVQOO_zaM/1/public/full/R5C4"
			}],
			"gs$cell": {
				"row": "5",
				"col": "4",
				"inputValue": "https://ulisboa-my.sharepoint.com/:f:/r/personal/ist197096_tecnico_ulisboa_pt/Documents/EA/homework/ps%2304_2020_03_22?csf\u003d1\u0026web\u003d1\u0026e\u003dkeuPaD",
				"$t": "https://ulisboa-my.sharepoint.com/:f:/r/personal/ist197096_tecnico_ulisboa_pt/Documents/EA/homework/ps%2304_2020_03_22?csf\u003d1\u0026web\u003d1\u0026e\u003dkeuPaD"
			}
		}, {
			"id": {
				"$t": "https://spreadsheets.google.com/feeds/cells/1svNxbDR3mKKmLCdcTmMmj2XaI2bl-bA-cSOVQOO_zaM/1/public/full/R5C5"
			},
			"updated": {
				"$t": "2020-05-13T13:59:08.728Z"
			},
			"category": [{
				"scheme": "http://schemas.google.com/spreadsheets/2006",
				"term": "http://schemas.google.com/spreadsheets/2006#cell"
			}],
			"title": {
				"type": "text",
				"$t": "E5"
			},
			"content": {
				"type": "text",
				"$t": "2020/03/17 15:00"
			},
			"link": [{
				"rel": "self",
				"type": "application/atom+xml",
				"href": "https://spreadsheets.google.com/feeds/cells/1svNxbDR3mKKmLCdcTmMmj2XaI2bl-bA-cSOVQOO_zaM/1/public/full/R5C5"
			}],
			"gs$cell": {
				"row": "5",
				"col": "5",
				"inputValue": "3/17/2020 15:00:00",
				"numericValue": "43907.625",
				"$t": "2020/03/17 15:00"
			}
		}, {
			"id": {
				"$t": "https://spreadsheets.google.com/feeds/cells/1svNxbDR3mKKmLCdcTmMmj2XaI2bl-bA-cSOVQOO_zaM/1/public/full/R5C6"
			},
			"updated": {
				"$t": "2020-05-13T13:59:08.728Z"
			},
			"category": [{
				"scheme": "http://schemas.google.com/spreadsheets/2006",
				"term": "http://schemas.google.com/spreadsheets/2006#cell"
			}],
			"title": {
				"type": "text",
				"$t": "F5"
			},
			"content": {
				"type": "text",
				"$t": "2020/03/22 23:59"
			},
			"link": [{
				"rel": "self",
				"type": "application/atom+xml",
				"href": "https://spreadsheets.google.com/feeds/cells/1svNxbDR3mKKmLCdcTmMmj2XaI2bl-bA-cSOVQOO_zaM/1/public/full/R5C6"
			}],
			"gs$cell": {
				"row": "5",
				"col": "6",
				"inputValue": "3/22/2020 23:59:00",
				"numericValue": "43912.99930555555",
				"$t": "2020/03/22 23:59"
			}
		}, {
			"id": {
				"$t": "https://spreadsheets.google.com/feeds/cells/1svNxbDR3mKKmLCdcTmMmj2XaI2bl-bA-cSOVQOO_zaM/1/public/full/R6C1"
			},
			"updated": {
				"$t": "2020-05-13T13:59:08.728Z"
			},
			"category": [{
				"scheme": "http://schemas.google.com/spreadsheets/2006",
				"term": "http://schemas.google.com/spreadsheets/2006#cell"
			}],
			"title": {
				"type": "text",
				"$t": "A6"
			},
			"content": {
				"type": "text",
				"$t": "EA"
			},
			"link": [{
				"rel": "self",
				"type": "application/atom+xml",
				"href": "https://spreadsheets.google.com/feeds/cells/1svNxbDR3mKKmLCdcTmMmj2XaI2bl-bA-cSOVQOO_zaM/1/public/full/R6C1"
			}],
			"gs$cell": {
				"row": "6",
				"col": "1",
				"inputValue": "EA",
				"$t": "EA"
			}
		}, {
			"id": {
				"$t": "https://spreadsheets.google.com/feeds/cells/1svNxbDR3mKKmLCdcTmMmj2XaI2bl-bA-cSOVQOO_zaM/1/public/full/R6C2"
			},
			"updated": {
				"$t": "2020-05-13T13:59:08.728Z"
			},
			"category": [{
				"scheme": "http://schemas.google.com/spreadsheets/2006",
				"term": "http://schemas.google.com/spreadsheets/2006#cell"
			}],
			"title": {
				"type": "text",
				"$t": "B6"
			},
			"content": {
				"type": "text",
				"$t": "Homework Bonus #05"
			},
			"link": [{
				"rel": "self",
				"type": "application/atom+xml",
				"href": "https://spreadsheets.google.com/feeds/cells/1svNxbDR3mKKmLCdcTmMmj2XaI2bl-bA-cSOVQOO_zaM/1/public/full/R6C2"
			}],
			"gs$cell": {
				"row": "6",
				"col": "2",
				"inputValue": "Homework Bonus #05",
				"$t": "Homework Bonus #05"
			}
		}, {
			"id": {
				"$t": "https://spreadsheets.google.com/feeds/cells/1svNxbDR3mKKmLCdcTmMmj2XaI2bl-bA-cSOVQOO_zaM/1/public/full/R6C3"
			},
			"updated": {
				"$t": "2020-05-13T13:59:08.728Z"
			},
			"category": [{
				"scheme": "http://schemas.google.com/spreadsheets/2006",
				"term": "http://schemas.google.com/spreadsheets/2006#cell"
			}],
			"title": {
				"type": "text",
				"$t": "C6"
			},
			"content": {
				"type": "text",
				"$t": "homework"
			},
			"link": [{
				"rel": "self",
				"type": "application/atom+xml",
				"href": "https://spreadsheets.google.com/feeds/cells/1svNxbDR3mKKmLCdcTmMmj2XaI2bl-bA-cSOVQOO_zaM/1/public/full/R6C3"
			}],
			"gs$cell": {
				"row": "6",
				"col": "3",
				"inputValue": "homework",
				"$t": "homework"
			}
		}, {
			"id": {
				"$t": "https://spreadsheets.google.com/feeds/cells/1svNxbDR3mKKmLCdcTmMmj2XaI2bl-bA-cSOVQOO_zaM/1/public/full/R6C4"
			},
			"updated": {
				"$t": "2020-05-13T13:59:08.728Z"
			},
			"category": [{
				"scheme": "http://schemas.google.com/spreadsheets/2006",
				"term": "http://schemas.google.com/spreadsheets/2006#cell"
			}],
			"title": {
				"type": "text",
				"$t": "D6"
			},
			"content": {
				"type": "text",
				"$t": "https://ulisboa-my.sharepoint.com/:f:/r/personal/ist197096_tecnico_ulisboa_pt/Documents/EA/homework/ps%2305_2020_03_29?csf\u003d1\u0026web\u003d1\u0026e\u003dZrtRVy"
			},
			"link": [{
				"rel": "self",
				"type": "application/atom+xml",
				"href": "https://spreadsheets.google.com/feeds/cells/1svNxbDR3mKKmLCdcTmMmj2XaI2bl-bA-cSOVQOO_zaM/1/public/full/R6C4"
			}],
			"gs$cell": {
				"row": "6",
				"col": "4",
				"inputValue": "https://ulisboa-my.sharepoint.com/:f:/r/personal/ist197096_tecnico_ulisboa_pt/Documents/EA/homework/ps%2305_2020_03_29?csf\u003d1\u0026web\u003d1\u0026e\u003dZrtRVy",
				"$t": "https://ulisboa-my.sharepoint.com/:f:/r/personal/ist197096_tecnico_ulisboa_pt/Documents/EA/homework/ps%2305_2020_03_29?csf\u003d1\u0026web\u003d1\u0026e\u003dZrtRVy"
			}
		}, {
			"id": {
				"$t": "https://spreadsheets.google.com/feeds/cells/1svNxbDR3mKKmLCdcTmMmj2XaI2bl-bA-cSOVQOO_zaM/1/public/full/R6C5"
			},
			"updated": {
				"$t": "2020-05-13T13:59:08.728Z"
			},
			"category": [{
				"scheme": "http://schemas.google.com/spreadsheets/2006",
				"term": "http://schemas.google.com/spreadsheets/2006#cell"
			}],
			"title": {
				"type": "text",
				"$t": "E6"
			},
			"content": {
				"type": "text",
				"$t": "2020/03/24 14:00"
			},
			"link": [{
				"rel": "self",
				"type": "application/atom+xml",
				"href": "https://spreadsheets.google.com/feeds/cells/1svNxbDR3mKKmLCdcTmMmj2XaI2bl-bA-cSOVQOO_zaM/1/public/full/R6C5"
			}],
			"gs$cell": {
				"row": "6",
				"col": "5",
				"inputValue": "3/24/2020 14:00:00",
				"numericValue": "43914.583333333336",
				"$t": "2020/03/24 14:00"
			}
		}, {
			"id": {
				"$t": "https://spreadsheets.google.com/feeds/cells/1svNxbDR3mKKmLCdcTmMmj2XaI2bl-bA-cSOVQOO_zaM/1/public/full/R6C6"
			},
			"updated": {
				"$t": "2020-05-13T13:59:08.728Z"
			},
			"category": [{
				"scheme": "http://schemas.google.com/spreadsheets/2006",
				"term": "http://schemas.google.com/spreadsheets/2006#cell"
			}],
			"title": {
				"type": "text",
				"$t": "F6"
			},
			"content": {
				"type": "text",
				"$t": "2020/03/29 23:59"
			},
			"link": [{
				"rel": "self",
				"type": "application/atom+xml",
				"href": "https://spreadsheets.google.com/feeds/cells/1svNxbDR3mKKmLCdcTmMmj2XaI2bl-bA-cSOVQOO_zaM/1/public/full/R6C6"
			}],
			"gs$cell": {
				"row": "6",
				"col": "6",
				"inputValue": "3/29/2020 23:59:00",
				"numericValue": "43919.99930555555",
				"$t": "2020/03/29 23:59"
			}
		}, {
			"id": {
				"$t": "https://spreadsheets.google.com/feeds/cells/1svNxbDR3mKKmLCdcTmMmj2XaI2bl-bA-cSOVQOO_zaM/1/public/full/R7C1"
			},
			"updated": {
				"$t": "2020-05-13T13:59:08.728Z"
			},
			"category": [{
				"scheme": "http://schemas.google.com/spreadsheets/2006",
				"term": "http://schemas.google.com/spreadsheets/2006#cell"
			}],
			"title": {
				"type": "text",
				"$t": "A7"
			},
			"content": {
				"type": "text",
				"$t": "EA"
			},
			"link": [{
				"rel": "self",
				"type": "application/atom+xml",
				"href": "https://spreadsheets.google.com/feeds/cells/1svNxbDR3mKKmLCdcTmMmj2XaI2bl-bA-cSOVQOO_zaM/1/public/full/R7C1"
			}],
			"gs$cell": {
				"row": "7",
				"col": "1",
				"inputValue": "EA",
				"$t": "EA"
			}
		}, {
			"id": {
				"$t": "https://spreadsheets.google.com/feeds/cells/1svNxbDR3mKKmLCdcTmMmj2XaI2bl-bA-cSOVQOO_zaM/1/public/full/R7C2"
			},
			"updated": {
				"$t": "2020-05-13T13:59:08.728Z"
			},
			"category": [{
				"scheme": "http://schemas.google.com/spreadsheets/2006",
				"term": "http://schemas.google.com/spreadsheets/2006#cell"
			}],
			"title": {
				"type": "text",
				"$t": "B7"
			},
			"content": {
				"type": "text",
				"$t": "Homework Bonus #06"
			},
			"link": [{
				"rel": "self",
				"type": "application/atom+xml",
				"href": "https://spreadsheets.google.com/feeds/cells/1svNxbDR3mKKmLCdcTmMmj2XaI2bl-bA-cSOVQOO_zaM/1/public/full/R7C2"
			}],
			"gs$cell": {
				"row": "7",
				"col": "2",
				"inputValue": "Homework Bonus #06",
				"$t": "Homework Bonus #06"
			}
		}, {
			"id": {
				"$t": "https://spreadsheets.google.com/feeds/cells/1svNxbDR3mKKmLCdcTmMmj2XaI2bl-bA-cSOVQOO_zaM/1/public/full/R7C3"
			},
			"updated": {
				"$t": "2020-05-13T13:59:08.728Z"
			},
			"category": [{
				"scheme": "http://schemas.google.com/spreadsheets/2006",
				"term": "http://schemas.google.com/spreadsheets/2006#cell"
			}],
			"title": {
				"type": "text",
				"$t": "C7"
			},
			"content": {
				"type": "text",
				"$t": "homework"
			},
			"link": [{
				"rel": "self",
				"type": "application/atom+xml",
				"href": "https://spreadsheets.google.com/feeds/cells/1svNxbDR3mKKmLCdcTmMmj2XaI2bl-bA-cSOVQOO_zaM/1/public/full/R7C3"
			}],
			"gs$cell": {
				"row": "7",
				"col": "3",
				"inputValue": "homework",
				"$t": "homework"
			}
		}, {
			"id": {
				"$t": "https://spreadsheets.google.com/feeds/cells/1svNxbDR3mKKmLCdcTmMmj2XaI2bl-bA-cSOVQOO_zaM/1/public/full/R7C4"
			},
			"updated": {
				"$t": "2020-05-13T13:59:08.728Z"
			},
			"category": [{
				"scheme": "http://schemas.google.com/spreadsheets/2006",
				"term": "http://schemas.google.com/spreadsheets/2006#cell"
			}],
			"title": {
				"type": "text",
				"$t": "D7"
			},
			"content": {
				"type": "text",
				"$t": "https://ulisboa-my.sharepoint.com/:f:/r/personal/ist197096_tecnico_ulisboa_pt/Documents/EA/homework/ps%2306_2020_04_12?csf\u003d1\u0026web\u003d1\u0026e\u003d5aMeui"
			},
			"link": [{
				"rel": "self",
				"type": "application/atom+xml",
				"href": "https://spreadsheets.google.com/feeds/cells/1svNxbDR3mKKmLCdcTmMmj2XaI2bl-bA-cSOVQOO_zaM/1/public/full/R7C4"
			}],
			"gs$cell": {
				"row": "7",
				"col": "4",
				"inputValue": "https://ulisboa-my.sharepoint.com/:f:/r/personal/ist197096_tecnico_ulisboa_pt/Documents/EA/homework/ps%2306_2020_04_12?csf\u003d1\u0026web\u003d1\u0026e\u003d5aMeui",
				"$t": "https://ulisboa-my.sharepoint.com/:f:/r/personal/ist197096_tecnico_ulisboa_pt/Documents/EA/homework/ps%2306_2020_04_12?csf\u003d1\u0026web\u003d1\u0026e\u003d5aMeui"
			}
		}, {
			"id": {
				"$t": "https://spreadsheets.google.com/feeds/cells/1svNxbDR3mKKmLCdcTmMmj2XaI2bl-bA-cSOVQOO_zaM/1/public/full/R7C5"
			},
			"updated": {
				"$t": "2020-05-13T13:59:08.728Z"
			},
			"category": [{
				"scheme": "http://schemas.google.com/spreadsheets/2006",
				"term": "http://schemas.google.com/spreadsheets/2006#cell"
			}],
			"title": {
				"type": "text",
				"$t": "E7"
			},
			"content": {
				"type": "text",
				"$t": "2020/04/03 12:00"
			},
			"link": [{
				"rel": "self",
				"type": "application/atom+xml",
				"href": "https://spreadsheets.google.com/feeds/cells/1svNxbDR3mKKmLCdcTmMmj2XaI2bl-bA-cSOVQOO_zaM/1/public/full/R7C5"
			}],
			"gs$cell": {
				"row": "7",
				"col": "5",
				"inputValue": "4/3/2020 12:00:00",
				"numericValue": "43924.5",
				"$t": "2020/04/03 12:00"
			}
		}, {
			"id": {
				"$t": "https://spreadsheets.google.com/feeds/cells/1svNxbDR3mKKmLCdcTmMmj2XaI2bl-bA-cSOVQOO_zaM/1/public/full/R7C6"
			},
			"updated": {
				"$t": "2020-05-13T13:59:08.728Z"
			},
			"category": [{
				"scheme": "http://schemas.google.com/spreadsheets/2006",
				"term": "http://schemas.google.com/spreadsheets/2006#cell"
			}],
			"title": {
				"type": "text",
				"$t": "F7"
			},
			"content": {
				"type": "text",
				"$t": "2020/04/12 23:59"
			},
			"link": [{
				"rel": "self",
				"type": "application/atom+xml",
				"href": "https://spreadsheets.google.com/feeds/cells/1svNxbDR3mKKmLCdcTmMmj2XaI2bl-bA-cSOVQOO_zaM/1/public/full/R7C6"
			}],
			"gs$cell": {
				"row": "7",
				"col": "6",
				"inputValue": "4/12/2020 23:59:00",
				"numericValue": "43933.99930555555",
				"$t": "2020/04/12 23:59"
			}
		}, {
			"id": {
				"$t": "https://spreadsheets.google.com/feeds/cells/1svNxbDR3mKKmLCdcTmMmj2XaI2bl-bA-cSOVQOO_zaM/1/public/full/R8C1"
			},
			"updated": {
				"$t": "2020-05-13T13:59:08.728Z"
			},
			"category": [{
				"scheme": "http://schemas.google.com/spreadsheets/2006",
				"term": "http://schemas.google.com/spreadsheets/2006#cell"
			}],
			"title": {
				"type": "text",
				"$t": "A8"
			},
			"content": {
				"type": "text",
				"$t": "EA"
			},
			"link": [{
				"rel": "self",
				"type": "application/atom+xml",
				"href": "https://spreadsheets.google.com/feeds/cells/1svNxbDR3mKKmLCdcTmMmj2XaI2bl-bA-cSOVQOO_zaM/1/public/full/R8C1"
			}],
			"gs$cell": {
				"row": "8",
				"col": "1",
				"inputValue": "EA",
				"$t": "EA"
			}
		}, {
			"id": {
				"$t": "https://spreadsheets.google.com/feeds/cells/1svNxbDR3mKKmLCdcTmMmj2XaI2bl-bA-cSOVQOO_zaM/1/public/full/R8C2"
			},
			"updated": {
				"$t": "2020-05-13T13:59:08.728Z"
			},
			"category": [{
				"scheme": "http://schemas.google.com/spreadsheets/2006",
				"term": "http://schemas.google.com/spreadsheets/2006#cell"
			}],
			"title": {
				"type": "text",
				"$t": "B8"
			},
			"content": {
				"type": "text",
				"$t": "Homework Bonus #07"
			},
			"link": [{
				"rel": "self",
				"type": "application/atom+xml",
				"href": "https://spreadsheets.google.com/feeds/cells/1svNxbDR3mKKmLCdcTmMmj2XaI2bl-bA-cSOVQOO_zaM/1/public/full/R8C2"
			}],
			"gs$cell": {
				"row": "8",
				"col": "2",
				"inputValue": "Homework Bonus #07",
				"$t": "Homework Bonus #07"
			}
		}, {
			"id": {
				"$t": "https://spreadsheets.google.com/feeds/cells/1svNxbDR3mKKmLCdcTmMmj2XaI2bl-bA-cSOVQOO_zaM/1/public/full/R8C3"
			},
			"updated": {
				"$t": "2020-05-13T13:59:08.728Z"
			},
			"category": [{
				"scheme": "http://schemas.google.com/spreadsheets/2006",
				"term": "http://schemas.google.com/spreadsheets/2006#cell"
			}],
			"title": {
				"type": "text",
				"$t": "C8"
			},
			"content": {
				"type": "text",
				"$t": "homework"
			},
			"link": [{
				"rel": "self",
				"type": "application/atom+xml",
				"href": "https://spreadsheets.google.com/feeds/cells/1svNxbDR3mKKmLCdcTmMmj2XaI2bl-bA-cSOVQOO_zaM/1/public/full/R8C3"
			}],
			"gs$cell": {
				"row": "8",
				"col": "3",
				"inputValue": "homework",
				"$t": "homework"
			}
		}, {
			"id": {
				"$t": "https://spreadsheets.google.com/feeds/cells/1svNxbDR3mKKmLCdcTmMmj2XaI2bl-bA-cSOVQOO_zaM/1/public/full/R8C4"
			},
			"updated": {
				"$t": "2020-05-13T13:59:08.728Z"
			},
			"category": [{
				"scheme": "http://schemas.google.com/spreadsheets/2006",
				"term": "http://schemas.google.com/spreadsheets/2006#cell"
			}],
			"title": {
				"type": "text",
				"$t": "D8"
			},
			"content": {
				"type": "text",
				"$t": "https://ulisboa-my.sharepoint.com/:f:/r/personal/ist197096_tecnico_ulisboa_pt/Documents/EA/homework/ps%2307_2020_04_19?csf\u003d1\u0026web\u003d1\u0026e\u003dR0EQBl"
			},
			"link": [{
				"rel": "self",
				"type": "application/atom+xml",
				"href": "https://spreadsheets.google.com/feeds/cells/1svNxbDR3mKKmLCdcTmMmj2XaI2bl-bA-cSOVQOO_zaM/1/public/full/R8C4"
			}],
			"gs$cell": {
				"row": "8",
				"col": "4",
				"inputValue": "https://ulisboa-my.sharepoint.com/:f:/r/personal/ist197096_tecnico_ulisboa_pt/Documents/EA/homework/ps%2307_2020_04_19?csf\u003d1\u0026web\u003d1\u0026e\u003dR0EQBl",
				"$t": "https://ulisboa-my.sharepoint.com/:f:/r/personal/ist197096_tecnico_ulisboa_pt/Documents/EA/homework/ps%2307_2020_04_19?csf\u003d1\u0026web\u003d1\u0026e\u003dR0EQBl"
			}
		}, {
			"id": {
				"$t": "https://spreadsheets.google.com/feeds/cells/1svNxbDR3mKKmLCdcTmMmj2XaI2bl-bA-cSOVQOO_zaM/1/public/full/R8C5"
			},
			"updated": {
				"$t": "2020-05-13T13:59:08.728Z"
			},
			"category": [{
				"scheme": "http://schemas.google.com/spreadsheets/2006",
				"term": "http://schemas.google.com/spreadsheets/2006#cell"
			}],
			"title": {
				"type": "text",
				"$t": "E8"
			},
			"content": {
				"type": "text",
				"$t": "2020/04/18 0:01"
			},
			"link": [{
				"rel": "self",
				"type": "application/atom+xml",
				"href": "https://spreadsheets.google.com/feeds/cells/1svNxbDR3mKKmLCdcTmMmj2XaI2bl-bA-cSOVQOO_zaM/1/public/full/R8C5"
			}],
			"gs$cell": {
				"row": "8",
				"col": "5",
				"inputValue": "4/18/2020 0:01:00",
				"numericValue": "43939.00069444445",
				"$t": "2020/04/18 0:01"
			}
		}, {
			"id": {
				"$t": "https://spreadsheets.google.com/feeds/cells/1svNxbDR3mKKmLCdcTmMmj2XaI2bl-bA-cSOVQOO_zaM/1/public/full/R8C6"
			},
			"updated": {
				"$t": "2020-05-13T13:59:08.728Z"
			},
			"category": [{
				"scheme": "http://schemas.google.com/spreadsheets/2006",
				"term": "http://schemas.google.com/spreadsheets/2006#cell"
			}],
			"title": {
				"type": "text",
				"$t": "F8"
			},
			"content": {
				"type": "text",
				"$t": "2020/04/21 12:00"
			},
			"link": [{
				"rel": "self",
				"type": "application/atom+xml",
				"href": "https://spreadsheets.google.com/feeds/cells/1svNxbDR3mKKmLCdcTmMmj2XaI2bl-bA-cSOVQOO_zaM/1/public/full/R8C6"
			}],
			"gs$cell": {
				"row": "8",
				"col": "6",
				"inputValue": "4/21/2020 12:00:00",
				"numericValue": "43942.5",
				"$t": "2020/04/21 12:00"
			}
		}, {
			"id": {
				"$t": "https://spreadsheets.google.com/feeds/cells/1svNxbDR3mKKmLCdcTmMmj2XaI2bl-bA-cSOVQOO_zaM/1/public/full/R9C1"
			},
			"updated": {
				"$t": "2020-05-13T13:59:08.728Z"
			},
			"category": [{
				"scheme": "http://schemas.google.com/spreadsheets/2006",
				"term": "http://schemas.google.com/spreadsheets/2006#cell"
			}],
			"title": {
				"type": "text",
				"$t": "A9"
			},
			"content": {
				"type": "text",
				"$t": "EA"
			},
			"link": [{
				"rel": "self",
				"type": "application/atom+xml",
				"href": "https://spreadsheets.google.com/feeds/cells/1svNxbDR3mKKmLCdcTmMmj2XaI2bl-bA-cSOVQOO_zaM/1/public/full/R9C1"
			}],
			"gs$cell": {
				"row": "9",
				"col": "1",
				"inputValue": "EA",
				"$t": "EA"
			}
		}, {
			"id": {
				"$t": "https://spreadsheets.google.com/feeds/cells/1svNxbDR3mKKmLCdcTmMmj2XaI2bl-bA-cSOVQOO_zaM/1/public/full/R9C2"
			},
			"updated": {
				"$t": "2020-05-13T13:59:08.728Z"
			},
			"category": [{
				"scheme": "http://schemas.google.com/spreadsheets/2006",
				"term": "http://schemas.google.com/spreadsheets/2006#cell"
			}],
			"title": {
				"type": "text",
				"$t": "B9"
			},
			"content": {
				"type": "text",
				"$t": "Homework Bonus #08"
			},
			"link": [{
				"rel": "self",
				"type": "application/atom+xml",
				"href": "https://spreadsheets.google.com/feeds/cells/1svNxbDR3mKKmLCdcTmMmj2XaI2bl-bA-cSOVQOO_zaM/1/public/full/R9C2"
			}],
			"gs$cell": {
				"row": "9",
				"col": "2",
				"inputValue": "Homework Bonus #08",
				"$t": "Homework Bonus #08"
			}
		}, {
			"id": {
				"$t": "https://spreadsheets.google.com/feeds/cells/1svNxbDR3mKKmLCdcTmMmj2XaI2bl-bA-cSOVQOO_zaM/1/public/full/R9C3"
			},
			"updated": {
				"$t": "2020-05-13T13:59:08.728Z"
			},
			"category": [{
				"scheme": "http://schemas.google.com/spreadsheets/2006",
				"term": "http://schemas.google.com/spreadsheets/2006#cell"
			}],
			"title": {
				"type": "text",
				"$t": "C9"
			},
			"content": {
				"type": "text",
				"$t": "homework"
			},
			"link": [{
				"rel": "self",
				"type": "application/atom+xml",
				"href": "https://spreadsheets.google.com/feeds/cells/1svNxbDR3mKKmLCdcTmMmj2XaI2bl-bA-cSOVQOO_zaM/1/public/full/R9C3"
			}],
			"gs$cell": {
				"row": "9",
				"col": "3",
				"inputValue": "homework",
				"$t": "homework"
			}
		}, {
			"id": {
				"$t": "https://spreadsheets.google.com/feeds/cells/1svNxbDR3mKKmLCdcTmMmj2XaI2bl-bA-cSOVQOO_zaM/1/public/full/R9C4"
			},
			"updated": {
				"$t": "2020-05-13T13:59:08.728Z"
			},
			"category": [{
				"scheme": "http://schemas.google.com/spreadsheets/2006",
				"term": "http://schemas.google.com/spreadsheets/2006#cell"
			}],
			"title": {
				"type": "text",
				"$t": "D9"
			},
			"content": {
				"type": "text",
				"$t": "https://ulisboa-my.sharepoint.com/:f:/r/personal/ist197096_tecnico_ulisboa_pt/Documents/EA/homework/ps%2308_2020_04_26?csf\u003d1\u0026web\u003d1\u0026e\u003dDiQ0DS"
			},
			"link": [{
				"rel": "self",
				"type": "application/atom+xml",
				"href": "https://spreadsheets.google.com/feeds/cells/1svNxbDR3mKKmLCdcTmMmj2XaI2bl-bA-cSOVQOO_zaM/1/public/full/R9C4"
			}],
			"gs$cell": {
				"row": "9",
				"col": "4",
				"inputValue": "https://ulisboa-my.sharepoint.com/:f:/r/personal/ist197096_tecnico_ulisboa_pt/Documents/EA/homework/ps%2308_2020_04_26?csf\u003d1\u0026web\u003d1\u0026e\u003dDiQ0DS",
				"$t": "https://ulisboa-my.sharepoint.com/:f:/r/personal/ist197096_tecnico_ulisboa_pt/Documents/EA/homework/ps%2308_2020_04_26?csf\u003d1\u0026web\u003d1\u0026e\u003dDiQ0DS"
			}
		}, {
			"id": {
				"$t": "https://spreadsheets.google.com/feeds/cells/1svNxbDR3mKKmLCdcTmMmj2XaI2bl-bA-cSOVQOO_zaM/1/public/full/R9C5"
			},
			"updated": {
				"$t": "2020-05-13T13:59:08.728Z"
			},
			"category": [{
				"scheme": "http://schemas.google.com/spreadsheets/2006",
				"term": "http://schemas.google.com/spreadsheets/2006#cell"
			}],
			"title": {
				"type": "text",
				"$t": "E9"
			},
			"content": {
				"type": "text",
				"$t": "2020/04/23 20:00"
			},
			"link": [{
				"rel": "self",
				"type": "application/atom+xml",
				"href": "https://spreadsheets.google.com/feeds/cells/1svNxbDR3mKKmLCdcTmMmj2XaI2bl-bA-cSOVQOO_zaM/1/public/full/R9C5"
			}],
			"gs$cell": {
				"row": "9",
				"col": "5",
				"inputValue": "4/23/2020 20:00:00",
				"numericValue": "43944.833333333336",
				"$t": "2020/04/23 20:00"
			}
		}, {
			"id": {
				"$t": "https://spreadsheets.google.com/feeds/cells/1svNxbDR3mKKmLCdcTmMmj2XaI2bl-bA-cSOVQOO_zaM/1/public/full/R9C6"
			},
			"updated": {
				"$t": "2020-05-13T13:59:08.728Z"
			},
			"category": [{
				"scheme": "http://schemas.google.com/spreadsheets/2006",
				"term": "http://schemas.google.com/spreadsheets/2006#cell"
			}],
			"title": {
				"type": "text",
				"$t": "F9"
			},
			"content": {
				"type": "text",
				"$t": "2020/04/28 12:00"
			},
			"link": [{
				"rel": "self",
				"type": "application/atom+xml",
				"href": "https://spreadsheets.google.com/feeds/cells/1svNxbDR3mKKmLCdcTmMmj2XaI2bl-bA-cSOVQOO_zaM/1/public/full/R9C6"
			}],
			"gs$cell": {
				"row": "9",
				"col": "6",
				"inputValue": "4/28/2020 12:00:00",
				"numericValue": "43949.5",
				"$t": "2020/04/28 12:00"
			}
		}, {
			"id": {
				"$t": "https://spreadsheets.google.com/feeds/cells/1svNxbDR3mKKmLCdcTmMmj2XaI2bl-bA-cSOVQOO_zaM/1/public/full/R10C1"
			},
			"updated": {
				"$t": "2020-05-13T13:59:08.728Z"
			},
			"category": [{
				"scheme": "http://schemas.google.com/spreadsheets/2006",
				"term": "http://schemas.google.com/spreadsheets/2006#cell"
			}],
			"title": {
				"type": "text",
				"$t": "A10"
			},
			"content": {
				"type": "text",
				"$t": "EA"
			},
			"link": [{
				"rel": "self",
				"type": "application/atom+xml",
				"href": "https://spreadsheets.google.com/feeds/cells/1svNxbDR3mKKmLCdcTmMmj2XaI2bl-bA-cSOVQOO_zaM/1/public/full/R10C1"
			}],
			"gs$cell": {
				"row": "10",
				"col": "1",
				"inputValue": "EA",
				"$t": "EA"
			}
		}, {
			"id": {
				"$t": "https://spreadsheets.google.com/feeds/cells/1svNxbDR3mKKmLCdcTmMmj2XaI2bl-bA-cSOVQOO_zaM/1/public/full/R10C2"
			},
			"updated": {
				"$t": "2020-05-13T13:59:08.728Z"
			},
			"category": [{
				"scheme": "http://schemas.google.com/spreadsheets/2006",
				"term": "http://schemas.google.com/spreadsheets/2006#cell"
			}],
			"title": {
				"type": "text",
				"$t": "B10"
			},
			"content": {
				"type": "text",
				"$t": "Homework Bonus #09"
			},
			"link": [{
				"rel": "self",
				"type": "application/atom+xml",
				"href": "https://spreadsheets.google.com/feeds/cells/1svNxbDR3mKKmLCdcTmMmj2XaI2bl-bA-cSOVQOO_zaM/1/public/full/R10C2"
			}],
			"gs$cell": {
				"row": "10",
				"col": "2",
				"inputValue": "Homework Bonus #09",
				"$t": "Homework Bonus #09"
			}
		}, {
			"id": {
				"$t": "https://spreadsheets.google.com/feeds/cells/1svNxbDR3mKKmLCdcTmMmj2XaI2bl-bA-cSOVQOO_zaM/1/public/full/R10C3"
			},
			"updated": {
				"$t": "2020-05-13T13:59:08.728Z"
			},
			"category": [{
				"scheme": "http://schemas.google.com/spreadsheets/2006",
				"term": "http://schemas.google.com/spreadsheets/2006#cell"
			}],
			"title": {
				"type": "text",
				"$t": "C10"
			},
			"content": {
				"type": "text",
				"$t": "homework"
			},
			"link": [{
				"rel": "self",
				"type": "application/atom+xml",
				"href": "https://spreadsheets.google.com/feeds/cells/1svNxbDR3mKKmLCdcTmMmj2XaI2bl-bA-cSOVQOO_zaM/1/public/full/R10C3"
			}],
			"gs$cell": {
				"row": "10",
				"col": "3",
				"inputValue": "homework",
				"$t": "homework"
			}
		}, {
			"id": {
				"$t": "https://spreadsheets.google.com/feeds/cells/1svNxbDR3mKKmLCdcTmMmj2XaI2bl-bA-cSOVQOO_zaM/1/public/full/R10C4"
			},
			"updated": {
				"$t": "2020-05-13T13:59:08.728Z"
			},
			"category": [{
				"scheme": "http://schemas.google.com/spreadsheets/2006",
				"term": "http://schemas.google.com/spreadsheets/2006#cell"
			}],
			"title": {
				"type": "text",
				"$t": "D10"
			},
			"content": {
				"type": "text",
				"$t": "https://ulisboa-my.sharepoint.com/:f:/r/personal/ist197096_tecnico_ulisboa_pt/Documents/EA/homework/ps%2309_2020_05_05?csf\u003d1\u0026web\u003d1\u0026e\u003dqlONxk"
			},
			"link": [{
				"rel": "self",
				"type": "application/atom+xml",
				"href": "https://spreadsheets.google.com/feeds/cells/1svNxbDR3mKKmLCdcTmMmj2XaI2bl-bA-cSOVQOO_zaM/1/public/full/R10C4"
			}],
			"gs$cell": {
				"row": "10",
				"col": "4",
				"inputValue": "https://ulisboa-my.sharepoint.com/:f:/r/personal/ist197096_tecnico_ulisboa_pt/Documents/EA/homework/ps%2309_2020_05_05?csf\u003d1\u0026web\u003d1\u0026e\u003dqlONxk",
				"$t": "https://ulisboa-my.sharepoint.com/:f:/r/personal/ist197096_tecnico_ulisboa_pt/Documents/EA/homework/ps%2309_2020_05_05?csf\u003d1\u0026web\u003d1\u0026e\u003dqlONxk"
			}
		}, {
			"id": {
				"$t": "https://spreadsheets.google.com/feeds/cells/1svNxbDR3mKKmLCdcTmMmj2XaI2bl-bA-cSOVQOO_zaM/1/public/full/R10C5"
			},
			"updated": {
				"$t": "2020-05-13T13:59:08.728Z"
			},
			"category": [{
				"scheme": "http://schemas.google.com/spreadsheets/2006",
				"term": "http://schemas.google.com/spreadsheets/2006#cell"
			}],
			"title": {
				"type": "text",
				"$t": "E10"
			},
			"content": {
				"type": "text",
				"$t": "2020/04/28 14:00"
			},
			"link": [{
				"rel": "self",
				"type": "application/atom+xml",
				"href": "https://spreadsheets.google.com/feeds/cells/1svNxbDR3mKKmLCdcTmMmj2XaI2bl-bA-cSOVQOO_zaM/1/public/full/R10C5"
			}],
			"gs$cell": {
				"row": "10",
				"col": "5",
				"inputValue": "4/28/2020 14:00:00",
				"numericValue": "43949.583333333336",
				"$t": "2020/04/28 14:00"
			}
		}, {
			"id": {
				"$t": "https://spreadsheets.google.com/feeds/cells/1svNxbDR3mKKmLCdcTmMmj2XaI2bl-bA-cSOVQOO_zaM/1/public/full/R10C6"
			},
			"updated": {
				"$t": "2020-05-13T13:59:08.728Z"
			},
			"category": [{
				"scheme": "http://schemas.google.com/spreadsheets/2006",
				"term": "http://schemas.google.com/spreadsheets/2006#cell"
			}],
			"title": {
				"type": "text",
				"$t": "F10"
			},
			"content": {
				"type": "text",
				"$t": "2020/05/05 12:00"
			},
			"link": [{
				"rel": "self",
				"type": "application/atom+xml",
				"href": "https://spreadsheets.google.com/feeds/cells/1svNxbDR3mKKmLCdcTmMmj2XaI2bl-bA-cSOVQOO_zaM/1/public/full/R10C6"
			}],
			"gs$cell": {
				"row": "10",
				"col": "6",
				"inputValue": "5/5/2020 12:00:00",
				"numericValue": "43956.5",
				"$t": "2020/05/05 12:00"
			}
		}, {
			"id": {
				"$t": "https://spreadsheets.google.com/feeds/cells/1svNxbDR3mKKmLCdcTmMmj2XaI2bl-bA-cSOVQOO_zaM/1/public/full/R12C1"
			},
			"updated": {
				"$t": "2020-05-13T13:59:08.728Z"
			},
			"category": [{
				"scheme": "http://schemas.google.com/spreadsheets/2006",
				"term": "http://schemas.google.com/spreadsheets/2006#cell"
			}],
			"title": {
				"type": "text",
				"$t": "A12"
			},
			"content": {
				"type": "text",
				"$t": "EA"
			},
			"link": [{
				"rel": "self",
				"type": "application/atom+xml",
				"href": "https://spreadsheets.google.com/feeds/cells/1svNxbDR3mKKmLCdcTmMmj2XaI2bl-bA-cSOVQOO_zaM/1/public/full/R12C1"
			}],
			"gs$cell": {
				"row": "12",
				"col": "1",
				"inputValue": "EA",
				"$t": "EA"
			}
		}, {
			"id": {
				"$t": "https://spreadsheets.google.com/feeds/cells/1svNxbDR3mKKmLCdcTmMmj2XaI2bl-bA-cSOVQOO_zaM/1/public/full/R12C2"
			},
			"updated": {
				"$t": "2020-05-13T13:59:08.728Z"
			},
			"category": [{
				"scheme": "http://schemas.google.com/spreadsheets/2006",
				"term": "http://schemas.google.com/spreadsheets/2006#cell"
			}],
			"title": {
				"type": "text",
				"$t": "B12"
			},
			"content": {
				"type": "text",
				"$t": "Project: Additional Questions"
			},
			"link": [{
				"rel": "self",
				"type": "application/atom+xml",
				"href": "https://spreadsheets.google.com/feeds/cells/1svNxbDR3mKKmLCdcTmMmj2XaI2bl-bA-cSOVQOO_zaM/1/public/full/R12C2"
			}],
			"gs$cell": {
				"row": "12",
				"col": "2",
				"inputValue": "Project: Additional Questions",
				"$t": "Project: Additional Questions"
			}
		}, {
			"id": {
				"$t": "https://spreadsheets.google.com/feeds/cells/1svNxbDR3mKKmLCdcTmMmj2XaI2bl-bA-cSOVQOO_zaM/1/public/full/R12C3"
			},
			"updated": {
				"$t": "2020-05-13T13:59:08.728Z"
			},
			"category": [{
				"scheme": "http://schemas.google.com/spreadsheets/2006",
				"term": "http://schemas.google.com/spreadsheets/2006#cell"
			}],
			"title": {
				"type": "text",
				"$t": "C12"
			},
			"content": {
				"type": "text",
				"$t": "project"
			},
			"link": [{
				"rel": "self",
				"type": "application/atom+xml",
				"href": "https://spreadsheets.google.com/feeds/cells/1svNxbDR3mKKmLCdcTmMmj2XaI2bl-bA-cSOVQOO_zaM/1/public/full/R12C3"
			}],
			"gs$cell": {
				"row": "12",
				"col": "3",
				"inputValue": "project",
				"$t": "project"
			}
		}, {
			"id": {
				"$t": "https://spreadsheets.google.com/feeds/cells/1svNxbDR3mKKmLCdcTmMmj2XaI2bl-bA-cSOVQOO_zaM/1/public/full/R12C4"
			},
			"updated": {
				"$t": "2020-05-13T13:59:08.728Z"
			},
			"category": [{
				"scheme": "http://schemas.google.com/spreadsheets/2006",
				"term": "http://schemas.google.com/spreadsheets/2006#cell"
			}],
			"title": {
				"type": "text",
				"$t": "D12"
			},
			"content": {
				"type": "text",
				"$t": "https://drive.google.com/open?id\u003d1qBI5B3FfrEz4hMWYFxQsZ3Pi9gWq86CP"
			},
			"link": [{
				"rel": "self",
				"type": "application/atom+xml",
				"href": "https://spreadsheets.google.com/feeds/cells/1svNxbDR3mKKmLCdcTmMmj2XaI2bl-bA-cSOVQOO_zaM/1/public/full/R12C4"
			}],
			"gs$cell": {
				"row": "12",
				"col": "4",
				"inputValue": "https://drive.google.com/open?id\u003d1qBI5B3FfrEz4hMWYFxQsZ3Pi9gWq86CP",
				"$t": "https://drive.google.com/open?id\u003d1qBI5B3FfrEz4hMWYFxQsZ3Pi9gWq86CP"
			}
		}, {
			"id": {
				"$t": "https://spreadsheets.google.com/feeds/cells/1svNxbDR3mKKmLCdcTmMmj2XaI2bl-bA-cSOVQOO_zaM/1/public/full/R12C5"
			},
			"updated": {
				"$t": "2020-05-13T13:59:08.728Z"
			},
			"category": [{
				"scheme": "http://schemas.google.com/spreadsheets/2006",
				"term": "http://schemas.google.com/spreadsheets/2006#cell"
			}],
			"title": {
				"type": "text",
				"$t": "E12"
			},
			"content": {
				"type": "text",
				"$t": "2020/03/04 12:00"
			},
			"link": [{
				"rel": "self",
				"type": "application/atom+xml",
				"href": "https://spreadsheets.google.com/feeds/cells/1svNxbDR3mKKmLCdcTmMmj2XaI2bl-bA-cSOVQOO_zaM/1/public/full/R12C5"
			}],
			"gs$cell": {
				"row": "12",
				"col": "5",
				"inputValue": "3/4/2020 12:00:00",
				"numericValue": "43894.5",
				"$t": "2020/03/04 12:00"
			}
		}, {
			"id": {
				"$t": "https://spreadsheets.google.com/feeds/cells/1svNxbDR3mKKmLCdcTmMmj2XaI2bl-bA-cSOVQOO_zaM/1/public/full/R12C6"
			},
			"updated": {
				"$t": "2020-05-13T13:59:08.728Z"
			},
			"category": [{
				"scheme": "http://schemas.google.com/spreadsheets/2006",
				"term": "http://schemas.google.com/spreadsheets/2006#cell"
			}],
			"title": {
				"type": "text",
				"$t": "F12"
			},
			"content": {
				"type": "text",
				"$t": "2020/03/13 23:59"
			},
			"link": [{
				"rel": "self",
				"type": "application/atom+xml",
				"href": "https://spreadsheets.google.com/feeds/cells/1svNxbDR3mKKmLCdcTmMmj2XaI2bl-bA-cSOVQOO_zaM/1/public/full/R12C6"
			}],
			"gs$cell": {
				"row": "12",
				"col": "6",
				"inputValue": "3/13/2020 23:59:00",
				"numericValue": "43903.99930555555",
				"$t": "2020/03/13 23:59"
			}
		}, {
			"id": {
				"$t": "https://spreadsheets.google.com/feeds/cells/1svNxbDR3mKKmLCdcTmMmj2XaI2bl-bA-cSOVQOO_zaM/1/public/full/R13C1"
			},
			"updated": {
				"$t": "2020-05-13T13:59:08.728Z"
			},
			"category": [{
				"scheme": "http://schemas.google.com/spreadsheets/2006",
				"term": "http://schemas.google.com/spreadsheets/2006#cell"
			}],
			"title": {
				"type": "text",
				"$t": "A13"
			},
			"content": {
				"type": "text",
				"$t": "EA"
			},
			"link": [{
				"rel": "self",
				"type": "application/atom+xml",
				"href": "https://spreadsheets.google.com/feeds/cells/1svNxbDR3mKKmLCdcTmMmj2XaI2bl-bA-cSOVQOO_zaM/1/public/full/R13C1"
			}],
			"gs$cell": {
				"row": "13",
				"col": "1",
				"inputValue": "EA",
				"$t": "EA"
			}
		}, {
			"id": {
				"$t": "https://spreadsheets.google.com/feeds/cells/1svNxbDR3mKKmLCdcTmMmj2XaI2bl-bA-cSOVQOO_zaM/1/public/full/R13C2"
			},
			"updated": {
				"$t": "2020-05-13T13:59:08.728Z"
			},
			"category": [{
				"scheme": "http://schemas.google.com/spreadsheets/2006",
				"term": "http://schemas.google.com/spreadsheets/2006#cell"
			}],
			"title": {
				"type": "text",
				"$t": "B13"
			},
			"content": {
				"type": "text",
				"$t": "Project: 1st delivery"
			},
			"link": [{
				"rel": "self",
				"type": "application/atom+xml",
				"href": "https://spreadsheets.google.com/feeds/cells/1svNxbDR3mKKmLCdcTmMmj2XaI2bl-bA-cSOVQOO_zaM/1/public/full/R13C2"
			}],
			"gs$cell": {
				"row": "13",
				"col": "2",
				"inputValue": "Project: 1st delivery",
				"$t": "Project: 1st delivery"
			}
		}, {
			"id": {
				"$t": "https://spreadsheets.google.com/feeds/cells/1svNxbDR3mKKmLCdcTmMmj2XaI2bl-bA-cSOVQOO_zaM/1/public/full/R13C3"
			},
			"updated": {
				"$t": "2020-05-13T13:59:08.728Z"
			},
			"category": [{
				"scheme": "http://schemas.google.com/spreadsheets/2006",
				"term": "http://schemas.google.com/spreadsheets/2006#cell"
			}],
			"title": {
				"type": "text",
				"$t": "C13"
			},
			"content": {
				"type": "text",
				"$t": "project"
			},
			"link": [{
				"rel": "self",
				"type": "application/atom+xml",
				"href": "https://spreadsheets.google.com/feeds/cells/1svNxbDR3mKKmLCdcTmMmj2XaI2bl-bA-cSOVQOO_zaM/1/public/full/R13C3"
			}],
			"gs$cell": {
				"row": "13",
				"col": "3",
				"inputValue": "project",
				"$t": "project"
			}
		}, {
			"id": {
				"$t": "https://spreadsheets.google.com/feeds/cells/1svNxbDR3mKKmLCdcTmMmj2XaI2bl-bA-cSOVQOO_zaM/1/public/full/R13C4"
			},
			"updated": {
				"$t": "2020-05-13T13:59:08.728Z"
			},
			"category": [{
				"scheme": "http://schemas.google.com/spreadsheets/2006",
				"term": "http://schemas.google.com/spreadsheets/2006#cell"
			}],
			"title": {
				"type": "text",
				"$t": "D13"
			},
			"content": {
				"type": "text",
				"$t": "https://drive.google.com/open?id\u003d1q1rtLnS2bkOXEBpvRU0-jYxcPGPLCDrU"
			},
			"link": [{
				"rel": "self",
				"type": "application/atom+xml",
				"href": "https://spreadsheets.google.com/feeds/cells/1svNxbDR3mKKmLCdcTmMmj2XaI2bl-bA-cSOVQOO_zaM/1/public/full/R13C4"
			}],
			"gs$cell": {
				"row": "13",
				"col": "4",
				"inputValue": "https://drive.google.com/open?id\u003d1q1rtLnS2bkOXEBpvRU0-jYxcPGPLCDrU",
				"$t": "https://drive.google.com/open?id\u003d1q1rtLnS2bkOXEBpvRU0-jYxcPGPLCDrU"
			}
		}, {
			"id": {
				"$t": "https://spreadsheets.google.com/feeds/cells/1svNxbDR3mKKmLCdcTmMmj2XaI2bl-bA-cSOVQOO_zaM/1/public/full/R13C5"
			},
			"updated": {
				"$t": "2020-05-13T13:59:08.728Z"
			},
			"category": [{
				"scheme": "http://schemas.google.com/spreadsheets/2006",
				"term": "http://schemas.google.com/spreadsheets/2006#cell"
			}],
			"title": {
				"type": "text",
				"$t": "E13"
			},
			"content": {
				"type": "text",
				"$t": "2020/03/04 12:00"
			},
			"link": [{
				"rel": "self",
				"type": "application/atom+xml",
				"href": "https://spreadsheets.google.com/feeds/cells/1svNxbDR3mKKmLCdcTmMmj2XaI2bl-bA-cSOVQOO_zaM/1/public/full/R13C5"
			}],
			"gs$cell": {
				"row": "13",
				"col": "5",
				"inputValue": "3/4/2020 12:00:00",
				"numericValue": "43894.5",
				"$t": "2020/03/04 12:00"
			}
		}, {
			"id": {
				"$t": "https://spreadsheets.google.com/feeds/cells/1svNxbDR3mKKmLCdcTmMmj2XaI2bl-bA-cSOVQOO_zaM/1/public/full/R13C6"
			},
			"updated": {
				"$t": "2020-05-13T13:59:08.728Z"
			},
			"category": [{
				"scheme": "http://schemas.google.com/spreadsheets/2006",
				"term": "http://schemas.google.com/spreadsheets/2006#cell"
			}],
			"title": {
				"type": "text",
				"$t": "F13"
			},
			"content": {
				"type": "text",
				"$t": "2020/04/03 23:59"
			},
			"link": [{
				"rel": "self",
				"type": "application/atom+xml",
				"href": "https://spreadsheets.google.com/feeds/cells/1svNxbDR3mKKmLCdcTmMmj2XaI2bl-bA-cSOVQOO_zaM/1/public/full/R13C6"
			}],
			"gs$cell": {
				"row": "13",
				"col": "6",
				"inputValue": "4/3/2020 23:59:00",
				"numericValue": "43924.99930555555",
				"$t": "2020/04/03 23:59"
			}
		}, {
			"id": {
				"$t": "https://spreadsheets.google.com/feeds/cells/1svNxbDR3mKKmLCdcTmMmj2XaI2bl-bA-cSOVQOO_zaM/1/public/full/R14C1"
			},
			"updated": {
				"$t": "2020-05-13T13:59:08.728Z"
			},
			"category": [{
				"scheme": "http://schemas.google.com/spreadsheets/2006",
				"term": "http://schemas.google.com/spreadsheets/2006#cell"
			}],
			"title": {
				"type": "text",
				"$t": "A14"
			},
			"content": {
				"type": "text",
				"$t": "EA"
			},
			"link": [{
				"rel": "self",
				"type": "application/atom+xml",
				"href": "https://spreadsheets.google.com/feeds/cells/1svNxbDR3mKKmLCdcTmMmj2XaI2bl-bA-cSOVQOO_zaM/1/public/full/R14C1"
			}],
			"gs$cell": {
				"row": "14",
				"col": "1",
				"inputValue": "EA",
				"$t": "EA"
			}
		}, {
			"id": {
				"$t": "https://spreadsheets.google.com/feeds/cells/1svNxbDR3mKKmLCdcTmMmj2XaI2bl-bA-cSOVQOO_zaM/1/public/full/R14C2"
			},
			"updated": {
				"$t": "2020-05-13T13:59:08.728Z"
			},
			"category": [{
				"scheme": "http://schemas.google.com/spreadsheets/2006",
				"term": "http://schemas.google.com/spreadsheets/2006#cell"
			}],
			"title": {
				"type": "text",
				"$t": "B14"
			},
			"content": {
				"type": "text",
				"$t": "Project: Final delivery"
			},
			"link": [{
				"rel": "self",
				"type": "application/atom+xml",
				"href": "https://spreadsheets.google.com/feeds/cells/1svNxbDR3mKKmLCdcTmMmj2XaI2bl-bA-cSOVQOO_zaM/1/public/full/R14C2"
			}],
			"gs$cell": {
				"row": "14",
				"col": "2",
				"inputValue": "Project: Final delivery",
				"$t": "Project: Final delivery"
			}
		}, {
			"id": {
				"$t": "https://spreadsheets.google.com/feeds/cells/1svNxbDR3mKKmLCdcTmMmj2XaI2bl-bA-cSOVQOO_zaM/1/public/full/R14C3"
			},
			"updated": {
				"$t": "2020-05-13T13:59:08.728Z"
			},
			"category": [{
				"scheme": "http://schemas.google.com/spreadsheets/2006",
				"term": "http://schemas.google.com/spreadsheets/2006#cell"
			}],
			"title": {
				"type": "text",
				"$t": "C14"
			},
			"content": {
				"type": "text",
				"$t": "project"
			},
			"link": [{
				"rel": "self",
				"type": "application/atom+xml",
				"href": "https://spreadsheets.google.com/feeds/cells/1svNxbDR3mKKmLCdcTmMmj2XaI2bl-bA-cSOVQOO_zaM/1/public/full/R14C3"
			}],
			"gs$cell": {
				"row": "14",
				"col": "3",
				"inputValue": "project",
				"$t": "project"
			}
		}, {
			"id": {
				"$t": "https://spreadsheets.google.com/feeds/cells/1svNxbDR3mKKmLCdcTmMmj2XaI2bl-bA-cSOVQOO_zaM/1/public/full/R14C6"
			},
			"updated": {
				"$t": "2020-05-13T13:59:08.728Z"
			},
			"category": [{
				"scheme": "http://schemas.google.com/spreadsheets/2006",
				"term": "http://schemas.google.com/spreadsheets/2006#cell"
			}],
			"title": {
				"type": "text",
				"$t": "F14"
			},
			"content": {
				"type": "text",
				"$t": "2020/05/28 23:59"
			},
			"link": [{
				"rel": "self",
				"type": "application/atom+xml",
				"href": "https://spreadsheets.google.com/feeds/cells/1svNxbDR3mKKmLCdcTmMmj2XaI2bl-bA-cSOVQOO_zaM/1/public/full/R14C6"
			}],
			"gs$cell": {
				"row": "14",
				"col": "6",
				"inputValue": "5/28/2020 23:59:00",
				"numericValue": "43979.99930555555",
				"$t": "2020/05/28 23:59"
			}
		}, {
			"id": {
				"$t": "https://spreadsheets.google.com/feeds/cells/1svNxbDR3mKKmLCdcTmMmj2XaI2bl-bA-cSOVQOO_zaM/1/public/full/R16C1"
			},
			"updated": {
				"$t": "2020-05-13T13:59:08.728Z"
			},
			"category": [{
				"scheme": "http://schemas.google.com/spreadsheets/2006",
				"term": "http://schemas.google.com/spreadsheets/2006#cell"
			}],
			"title": {
				"type": "text",
				"$t": "A16"
			},
			"content": {
				"type": "text",
				"$t": "EA"
			},
			"link": [{
				"rel": "self",
				"type": "application/atom+xml",
				"href": "https://spreadsheets.google.com/feeds/cells/1svNxbDR3mKKmLCdcTmMmj2XaI2bl-bA-cSOVQOO_zaM/1/public/full/R16C1"
			}],
			"gs$cell": {
				"row": "16",
				"col": "1",
				"inputValue": "EA",
				"$t": "EA"
			}
		}, {
			"id": {
				"$t": "https://spreadsheets.google.com/feeds/cells/1svNxbDR3mKKmLCdcTmMmj2XaI2bl-bA-cSOVQOO_zaM/1/public/full/R16C2"
			},
			"updated": {
				"$t": "2020-05-13T13:59:08.728Z"
			},
			"category": [{
				"scheme": "http://schemas.google.com/spreadsheets/2006",
				"term": "http://schemas.google.com/spreadsheets/2006#cell"
			}],
			"title": {
				"type": "text",
				"$t": "B16"
			},
			"content": {
				"type": "text",
				"$t": "Project: Presentation - parte 1"
			},
			"link": [{
				"rel": "self",
				"type": "application/atom+xml",
				"href": "https://spreadsheets.google.com/feeds/cells/1svNxbDR3mKKmLCdcTmMmj2XaI2bl-bA-cSOVQOO_zaM/1/public/full/R16C2"
			}],
			"gs$cell": {
				"row": "16",
				"col": "2",
				"inputValue": "Project: Presentation - parte 1",
				"$t": "Project: Presentation - parte 1"
			}
		}, {
			"id": {
				"$t": "https://spreadsheets.google.com/feeds/cells/1svNxbDR3mKKmLCdcTmMmj2XaI2bl-bA-cSOVQOO_zaM/1/public/full/R16C3"
			},
			"updated": {
				"$t": "2020-05-13T13:59:08.728Z"
			},
			"category": [{
				"scheme": "http://schemas.google.com/spreadsheets/2006",
				"term": "http://schemas.google.com/spreadsheets/2006#cell"
			}],
			"title": {
				"type": "text",
				"$t": "C16"
			},
			"content": {
				"type": "text",
				"$t": "exam"
			},
			"link": [{
				"rel": "self",
				"type": "application/atom+xml",
				"href": "https://spreadsheets.google.com/feeds/cells/1svNxbDR3mKKmLCdcTmMmj2XaI2bl-bA-cSOVQOO_zaM/1/public/full/R16C3"
			}],
			"gs$cell": {
				"row": "16",
				"col": "3",
				"inputValue": "exam",
				"$t": "exam"
			}
		}, {
			"id": {
				"$t": "https://spreadsheets.google.com/feeds/cells/1svNxbDR3mKKmLCdcTmMmj2XaI2bl-bA-cSOVQOO_zaM/1/public/full/R17C1"
			},
			"updated": {
				"$t": "2020-05-13T13:59:08.728Z"
			},
			"category": [{
				"scheme": "http://schemas.google.com/spreadsheets/2006",
				"term": "http://schemas.google.com/spreadsheets/2006#cell"
			}],
			"title": {
				"type": "text",
				"$t": "A17"
			},
			"content": {
				"type": "text",
				"$t": "EA"
			},
			"link": [{
				"rel": "self",
				"type": "application/atom+xml",
				"href": "https://spreadsheets.google.com/feeds/cells/1svNxbDR3mKKmLCdcTmMmj2XaI2bl-bA-cSOVQOO_zaM/1/public/full/R17C1"
			}],
			"gs$cell": {
				"row": "17",
				"col": "1",
				"inputValue": "EA",
				"$t": "EA"
			}
		}, {
			"id": {
				"$t": "https://spreadsheets.google.com/feeds/cells/1svNxbDR3mKKmLCdcTmMmj2XaI2bl-bA-cSOVQOO_zaM/1/public/full/R17C2"
			},
			"updated": {
				"$t": "2020-05-13T13:59:08.728Z"
			},
			"category": [{
				"scheme": "http://schemas.google.com/spreadsheets/2006",
				"term": "http://schemas.google.com/spreadsheets/2006#cell"
			}],
			"title": {
				"type": "text",
				"$t": "B17"
			},
			"content": {
				"type": "text",
				"$t": "Project: Presentation - parte 2"
			},
			"link": [{
				"rel": "self",
				"type": "application/atom+xml",
				"href": "https://spreadsheets.google.com/feeds/cells/1svNxbDR3mKKmLCdcTmMmj2XaI2bl-bA-cSOVQOO_zaM/1/public/full/R17C2"
			}],
			"gs$cell": {
				"row": "17",
				"col": "2",
				"inputValue": "Project: Presentation - parte 2",
				"$t": "Project: Presentation - parte 2"
			}
		}, {
			"id": {
				"$t": "https://spreadsheets.google.com/feeds/cells/1svNxbDR3mKKmLCdcTmMmj2XaI2bl-bA-cSOVQOO_zaM/1/public/full/R17C3"
			},
			"updated": {
				"$t": "2020-05-13T13:59:08.728Z"
			},
			"category": [{
				"scheme": "http://schemas.google.com/spreadsheets/2006",
				"term": "http://schemas.google.com/spreadsheets/2006#cell"
			}],
			"title": {
				"type": "text",
				"$t": "C17"
			},
			"content": {
				"type": "text",
				"$t": "exam"
			},
			"link": [{
				"rel": "self",
				"type": "application/atom+xml",
				"href": "https://spreadsheets.google.com/feeds/cells/1svNxbDR3mKKmLCdcTmMmj2XaI2bl-bA-cSOVQOO_zaM/1/public/full/R17C3"
			}],
			"gs$cell": {
				"row": "17",
				"col": "3",
				"inputValue": "exam",
				"$t": "exam"
			}
		}, {
			"id": {
				"$t": "https://spreadsheets.google.com/feeds/cells/1svNxbDR3mKKmLCdcTmMmj2XaI2bl-bA-cSOVQOO_zaM/1/public/full/R18C1"
			},
			"updated": {
				"$t": "2020-05-13T13:59:08.728Z"
			},
			"category": [{
				"scheme": "http://schemas.google.com/spreadsheets/2006",
				"term": "http://schemas.google.com/spreadsheets/2006#cell"
			}],
			"title": {
				"type": "text",
				"$t": "A18"
			},
			"content": {
				"type": "text",
				"$t": "EA"
			},
			"link": [{
				"rel": "self",
				"type": "application/atom+xml",
				"href": "https://spreadsheets.google.com/feeds/cells/1svNxbDR3mKKmLCdcTmMmj2XaI2bl-bA-cSOVQOO_zaM/1/public/full/R18C1"
			}],
			"gs$cell": {
				"row": "18",
				"col": "1",
				"inputValue": "EA",
				"$t": "EA"
			}
		}, {
			"id": {
				"$t": "https://spreadsheets.google.com/feeds/cells/1svNxbDR3mKKmLCdcTmMmj2XaI2bl-bA-cSOVQOO_zaM/1/public/full/R18C2"
			},
			"updated": {
				"$t": "2020-05-13T13:59:08.728Z"
			},
			"category": [{
				"scheme": "http://schemas.google.com/spreadsheets/2006",
				"term": "http://schemas.google.com/spreadsheets/2006#cell"
			}],
			"title": {
				"type": "text",
				"$t": "B18"
			},
			"content": {
				"type": "text",
				"$t": "Teste: Repescagem"
			},
			"link": [{
				"rel": "self",
				"type": "application/atom+xml",
				"href": "https://spreadsheets.google.com/feeds/cells/1svNxbDR3mKKmLCdcTmMmj2XaI2bl-bA-cSOVQOO_zaM/1/public/full/R18C2"
			}],
			"gs$cell": {
				"row": "18",
				"col": "2",
				"inputValue": "Teste: Repescagem",
				"$t": "Teste: Repescagem"
			}
		}, {
			"id": {
				"$t": "https://spreadsheets.google.com/feeds/cells/1svNxbDR3mKKmLCdcTmMmj2XaI2bl-bA-cSOVQOO_zaM/1/public/full/R18C3"
			},
			"updated": {
				"$t": "2020-05-13T13:59:08.728Z"
			},
			"category": [{
				"scheme": "http://schemas.google.com/spreadsheets/2006",
				"term": "http://schemas.google.com/spreadsheets/2006#cell"
			}],
			"title": {
				"type": "text",
				"$t": "C18"
			},
			"content": {
				"type": "text",
				"$t": "exam"
			},
			"link": [{
				"rel": "self",
				"type": "application/atom+xml",
				"href": "https://spreadsheets.google.com/feeds/cells/1svNxbDR3mKKmLCdcTmMmj2XaI2bl-bA-cSOVQOO_zaM/1/public/full/R18C3"
			}],
			"gs$cell": {
				"row": "18",
				"col": "3",
				"inputValue": "exam",
				"$t": "exam"
			}
		}, {
			"id": {
				"$t": "https://spreadsheets.google.com/feeds/cells/1svNxbDR3mKKmLCdcTmMmj2XaI2bl-bA-cSOVQOO_zaM/1/public/full/R20C1"
			},
			"updated": {
				"$t": "2020-05-13T13:59:08.728Z"
			},
			"category": [{
				"scheme": "http://schemas.google.com/spreadsheets/2006",
				"term": "http://schemas.google.com/spreadsheets/2006#cell"
			}],
			"title": {
				"type": "text",
				"$t": "A20"
			},
			"content": {
				"type": "text",
				"$t": "EA"
			},
			"link": [{
				"rel": "self",
				"type": "application/atom+xml",
				"href": "https://spreadsheets.google.com/feeds/cells/1svNxbDR3mKKmLCdcTmMmj2XaI2bl-bA-cSOVQOO_zaM/1/public/full/R20C1"
			}],
			"gs$cell": {
				"row": "20",
				"col": "1",
				"inputValue": "EA",
				"$t": "EA"
			}
		}, {
			"id": {
				"$t": "https://spreadsheets.google.com/feeds/cells/1svNxbDR3mKKmLCdcTmMmj2XaI2bl-bA-cSOVQOO_zaM/1/public/full/R20C2"
			},
			"updated": {
				"$t": "2020-05-13T13:59:08.728Z"
			},
			"category": [{
				"scheme": "http://schemas.google.com/spreadsheets/2006",
				"term": "http://schemas.google.com/spreadsheets/2006#cell"
			}],
			"title": {
				"type": "text",
				"$t": "B20"
			},
			"content": {
				"type": "text",
				"$t": "Exame: poca Especial"
			},
			"link": [{
				"rel": "self",
				"type": "application/atom+xml",
				"href": "https://spreadsheets.google.com/feeds/cells/1svNxbDR3mKKmLCdcTmMmj2XaI2bl-bA-cSOVQOO_zaM/1/public/full/R20C2"
			}],
			"gs$cell": {
				"row": "20",
				"col": "2",
				"inputValue": "Exame: poca Especial",
				"$t": "Exame: poca Especial"
			}
		}, {
			"id": {
				"$t": "https://spreadsheets.google.com/feeds/cells/1svNxbDR3mKKmLCdcTmMmj2XaI2bl-bA-cSOVQOO_zaM/1/public/full/R20C3"
			},
			"updated": {
				"$t": "2020-05-13T13:59:08.728Z"
			},
			"category": [{
				"scheme": "http://schemas.google.com/spreadsheets/2006",
				"term": "http://schemas.google.com/spreadsheets/2006#cell"
			}],
			"title": {
				"type": "text",
				"$t": "C20"
			},
			"content": {
				"type": "text",
				"$t": "exam"
			},
			"link": [{
				"rel": "self",
				"type": "application/atom+xml",
				"href": "https://spreadsheets.google.com/feeds/cells/1svNxbDR3mKKmLCdcTmMmj2XaI2bl-bA-cSOVQOO_zaM/1/public/full/R20C3"
			}],
			"gs$cell": {
				"row": "20",
				"col": "3",
				"inputValue": "exam",
				"$t": "exam"
			}
		}, {
			"id": {
				"$t": "https://spreadsheets.google.com/feeds/cells/1svNxbDR3mKKmLCdcTmMmj2XaI2bl-bA-cSOVQOO_zaM/1/public/full/R22C1"
			},
			"updated": {
				"$t": "2020-05-13T13:59:08.728Z"
			},
			"category": [{
				"scheme": "http://schemas.google.com/spreadsheets/2006",
				"term": "http://schemas.google.com/spreadsheets/2006#cell"
			}],
			"title": {
				"type": "text",
				"$t": "A22"
			},
			"content": {
				"type": "text",
				"$t": "IS"
			},
			"link": [{
				"rel": "self",
				"type": "application/atom+xml",
				"href": "https://spreadsheets.google.com/feeds/cells/1svNxbDR3mKKmLCdcTmMmj2XaI2bl-bA-cSOVQOO_zaM/1/public/full/R22C1"
			}],
			"gs$cell": {
				"row": "22",
				"col": "1",
				"inputValue": "IS",
				"$t": "IS"
			}
		}, {
			"id": {
				"$t": "https://spreadsheets.google.com/feeds/cells/1svNxbDR3mKKmLCdcTmMmj2XaI2bl-bA-cSOVQOO_zaM/1/public/full/R22C2"
			},
			"updated": {
				"$t": "2020-05-13T13:59:08.728Z"
			},
			"category": [{
				"scheme": "http://schemas.google.com/spreadsheets/2006",
				"term": "http://schemas.google.com/spreadsheets/2006#cell"
			}],
			"title": {
				"type": "text",
				"$t": "B22"
			},
			"content": {
				"type": "text",
				"$t": "Case A"
			},
			"link": [{
				"rel": "self",
				"type": "application/atom+xml",
				"href": "https://spreadsheets.google.com/feeds/cells/1svNxbDR3mKKmLCdcTmMmj2XaI2bl-bA-cSOVQOO_zaM/1/public/full/R22C2"
			}],
			"gs$cell": {
				"row": "22",
				"col": "2",
				"inputValue": "Case A",
				"$t": "Case A"
			}
		}, {
			"id": {
				"$t": "https://spreadsheets.google.com/feeds/cells/1svNxbDR3mKKmLCdcTmMmj2XaI2bl-bA-cSOVQOO_zaM/1/public/full/R22C3"
			},
			"updated": {
				"$t": "2020-05-13T13:59:08.728Z"
			},
			"category": [{
				"scheme": "http://schemas.google.com/spreadsheets/2006",
				"term": "http://schemas.google.com/spreadsheets/2006#cell"
			}],
			"title": {
				"type": "text",
				"$t": "C22"
			},
			"content": {
				"type": "text",
				"$t": "homework"
			},
			"link": [{
				"rel": "self",
				"type": "application/atom+xml",
				"href": "https://spreadsheets.google.com/feeds/cells/1svNxbDR3mKKmLCdcTmMmj2XaI2bl-bA-cSOVQOO_zaM/1/public/full/R22C3"
			}],
			"gs$cell": {
				"row": "22",
				"col": "3",
				"inputValue": "homework",
				"$t": "homework"
			}
		}, {
			"id": {
				"$t": "https://spreadsheets.google.com/feeds/cells/1svNxbDR3mKKmLCdcTmMmj2XaI2bl-bA-cSOVQOO_zaM/1/public/full/R22C4"
			},
			"updated": {
				"$t": "2020-05-13T13:59:08.728Z"
			},
			"category": [{
				"scheme": "http://schemas.google.com/spreadsheets/2006",
				"term": "http://schemas.google.com/spreadsheets/2006#cell"
			}],
			"title": {
				"type": "text",
				"$t": "D22"
			},
			"content": {
				"type": "text",
				"$t": "https://ulisboa-my.sharepoint.com/:f:/r/personal/ist197096_tecnico_ulisboa_pt/Documents/ISM/cases/cA_2020_02_22?csf\u003d1\u0026e\u003dlPlryc"
			},
			"link": [{
				"rel": "self",
				"type": "application/atom+xml",
				"href": "https://spreadsheets.google.com/feeds/cells/1svNxbDR3mKKmLCdcTmMmj2XaI2bl-bA-cSOVQOO_zaM/1/public/full/R22C4"
			}],
			"gs$cell": {
				"row": "22",
				"col": "4",
				"inputValue": "https://ulisboa-my.sharepoint.com/:f:/r/personal/ist197096_tecnico_ulisboa_pt/Documents/ISM/cases/cA_2020_02_22?csf\u003d1\u0026e\u003dlPlryc",
				"$t": "https://ulisboa-my.sharepoint.com/:f:/r/personal/ist197096_tecnico_ulisboa_pt/Documents/ISM/cases/cA_2020_02_22?csf\u003d1\u0026e\u003dlPlryc"
			}
		}, {
			"id": {
				"$t": "https://spreadsheets.google.com/feeds/cells/1svNxbDR3mKKmLCdcTmMmj2XaI2bl-bA-cSOVQOO_zaM/1/public/full/R22C5"
			},
			"updated": {
				"$t": "2020-05-13T13:59:08.728Z"
			},
			"category": [{
				"scheme": "http://schemas.google.com/spreadsheets/2006",
				"term": "http://schemas.google.com/spreadsheets/2006#cell"
			}],
			"title": {
				"type": "text",
				"$t": "E22"
			},
			"content": {
				"type": "text",
				"$t": "2020/02/17 13:00"
			},
			"link": [{
				"rel": "self",
				"type": "application/atom+xml",
				"href": "https://spreadsheets.google.com/feeds/cells/1svNxbDR3mKKmLCdcTmMmj2XaI2bl-bA-cSOVQOO_zaM/1/public/full/R22C5"
			}],
			"gs$cell": {
				"row": "22",
				"col": "5",
				"inputValue": "2/17/2020 13:00:00",
				"numericValue": "43878.541666666664",
				"$t": "2020/02/17 13:00"
			}
		}, {
			"id": {
				"$t": "https://spreadsheets.google.com/feeds/cells/1svNxbDR3mKKmLCdcTmMmj2XaI2bl-bA-cSOVQOO_zaM/1/public/full/R22C6"
			},
			"updated": {
				"$t": "2020-05-13T13:59:08.728Z"
			},
			"category": [{
				"scheme": "http://schemas.google.com/spreadsheets/2006",
				"term": "http://schemas.google.com/spreadsheets/2006#cell"
			}],
			"title": {
				"type": "text",
				"$t": "F22"
			},
			"content": {
				"type": "text",
				"$t": "2020/02/22 13:00"
			},
			"link": [{
				"rel": "self",
				"type": "application/atom+xml",
				"href": "https://spreadsheets.google.com/feeds/cells/1svNxbDR3mKKmLCdcTmMmj2XaI2bl-bA-cSOVQOO_zaM/1/public/full/R22C6"
			}],
			"gs$cell": {
				"row": "22",
				"col": "6",
				"inputValue": "2/22/2020 13:00:00",
				"numericValue": "43883.541666666664",
				"$t": "2020/02/22 13:00"
			}
		}, {
			"id": {
				"$t": "https://spreadsheets.google.com/feeds/cells/1svNxbDR3mKKmLCdcTmMmj2XaI2bl-bA-cSOVQOO_zaM/1/public/full/R23C1"
			},
			"updated": {
				"$t": "2020-05-13T13:59:08.728Z"
			},
			"category": [{
				"scheme": "http://schemas.google.com/spreadsheets/2006",
				"term": "http://schemas.google.com/spreadsheets/2006#cell"
			}],
			"title": {
				"type": "text",
				"$t": "A23"
			},
			"content": {
				"type": "text",
				"$t": "IS"
			},
			"link": [{
				"rel": "self",
				"type": "application/atom+xml",
				"href": "https://spreadsheets.google.com/feeds/cells/1svNxbDR3mKKmLCdcTmMmj2XaI2bl-bA-cSOVQOO_zaM/1/public/full/R23C1"
			}],
			"gs$cell": {
				"row": "23",
				"col": "1",
				"inputValue": "IS",
				"$t": "IS"
			}
		}, {
			"id": {
				"$t": "https://spreadsheets.google.com/feeds/cells/1svNxbDR3mKKmLCdcTmMmj2XaI2bl-bA-cSOVQOO_zaM/1/public/full/R23C2"
			},
			"updated": {
				"$t": "2020-05-13T13:59:08.728Z"
			},
			"category": [{
				"scheme": "http://schemas.google.com/spreadsheets/2006",
				"term": "http://schemas.google.com/spreadsheets/2006#cell"
			}],
			"title": {
				"type": "text",
				"$t": "B23"
			},
			"content": {
				"type": "text",
				"$t": "Case A review"
			},
			"link": [{
				"rel": "self",
				"type": "application/atom+xml",
				"href": "https://spreadsheets.google.com/feeds/cells/1svNxbDR3mKKmLCdcTmMmj2XaI2bl-bA-cSOVQOO_zaM/1/public/full/R23C2"
			}],
			"gs$cell": {
				"row": "23",
				"col": "2",
				"inputValue": "Case A review",
				"$t": "Case A review"
			}
		}, {
			"id": {
				"$t": "https://spreadsheets.google.com/feeds/cells/1svNxbDR3mKKmLCdcTmMmj2XaI2bl-bA-cSOVQOO_zaM/1/public/full/R23C3"
			},
			"updated": {
				"$t": "2020-05-13T13:59:08.728Z"
			},
			"category": [{
				"scheme": "http://schemas.google.com/spreadsheets/2006",
				"term": "http://schemas.google.com/spreadsheets/2006#cell"
			}],
			"title": {
				"type": "text",
				"$t": "C23"
			},
			"content": {
				"type": "text",
				"$t": "homework"
			},
			"link": [{
				"rel": "self",
				"type": "application/atom+xml",
				"href": "https://spreadsheets.google.com/feeds/cells/1svNxbDR3mKKmLCdcTmMmj2XaI2bl-bA-cSOVQOO_zaM/1/public/full/R23C3"
			}],
			"gs$cell": {
				"row": "23",
				"col": "3",
				"inputValue": "homework",
				"$t": "homework"
			}
		}, {
			"id": {
				"$t": "https://spreadsheets.google.com/feeds/cells/1svNxbDR3mKKmLCdcTmMmj2XaI2bl-bA-cSOVQOO_zaM/1/public/full/R23C4"
			},
			"updated": {
				"$t": "2020-05-13T13:59:08.728Z"
			},
			"category": [{
				"scheme": "http://schemas.google.com/spreadsheets/2006",
				"term": "http://schemas.google.com/spreadsheets/2006#cell"
			}],
			"title": {
				"type": "text",
				"$t": "D23"
			},
			"content": {
				"type": "text",
				"$t": "https://ulisboa-my.sharepoint.com/:f:/r/personal/ist197096_tecnico_ulisboa_pt/Documents/ISM/cases/cA_2020_02_22/reviews?csf\u003d1\u0026e\u003dXqL8Nw"
			},
			"link": [{
				"rel": "self",
				"type": "application/atom+xml",
				"href": "https://spreadsheets.google.com/feeds/cells/1svNxbDR3mKKmLCdcTmMmj2XaI2bl-bA-cSOVQOO_zaM/1/public/full/R23C4"
			}],
			"gs$cell": {
				"row": "23",
				"col": "4",
				"inputValue": "https://ulisboa-my.sharepoint.com/:f:/r/personal/ist197096_tecnico_ulisboa_pt/Documents/ISM/cases/cA_2020_02_22/reviews?csf\u003d1\u0026e\u003dXqL8Nw",
				"$t": "https://ulisboa-my.sharepoint.com/:f:/r/personal/ist197096_tecnico_ulisboa_pt/Documents/ISM/cases/cA_2020_02_22/reviews?csf\u003d1\u0026e\u003dXqL8Nw"
			}
		}, {
			"id": {
				"$t": "https://spreadsheets.google.com/feeds/cells/1svNxbDR3mKKmLCdcTmMmj2XaI2bl-bA-cSOVQOO_zaM/1/public/full/R23C5"
			},
			"updated": {
				"$t": "2020-05-13T13:59:08.728Z"
			},
			"category": [{
				"scheme": "http://schemas.google.com/spreadsheets/2006",
				"term": "http://schemas.google.com/spreadsheets/2006#cell"
			}],
			"title": {
				"type": "text",
				"$t": "E23"
			},
			"content": {
				"type": "text",
				"$t": "2020/02/23 8:00"
			},
			"link": [{
				"rel": "self",
				"type": "application/atom+xml",
				"href": "https://spreadsheets.google.com/feeds/cells/1svNxbDR3mKKmLCdcTmMmj2XaI2bl-bA-cSOVQOO_zaM/1/public/full/R23C5"
			}],
			"gs$cell": {
				"row": "23",
				"col": "5",
				"inputValue": "2/23/2020 8:00:00",
				"numericValue": "43884.333333333336",
				"$t": "2020/02/23 8:00"
			}
		}, {
			"id": {
				"$t": "https://spreadsheets.google.com/feeds/cells/1svNxbDR3mKKmLCdcTmMmj2XaI2bl-bA-cSOVQOO_zaM/1/public/full/R23C6"
			},
			"updated": {
				"$t": "2020-05-13T13:59:08.728Z"
			},
			"category": [{
				"scheme": "http://schemas.google.com/spreadsheets/2006",
				"term": "http://schemas.google.com/spreadsheets/2006#cell"
			}],
			"title": {
				"type": "text",
				"$t": "F23"
			},
			"content": {
				"type": "text",
				"$t": "2020/02/24 23:59"
			},
			"link": [{
				"rel": "self",
				"type": "application/atom+xml",
				"href": "https://spreadsheets.google.com/feeds/cells/1svNxbDR3mKKmLCdcTmMmj2XaI2bl-bA-cSOVQOO_zaM/1/public/full/R23C6"
			}],
			"gs$cell": {
				"row": "23",
				"col": "6",
				"inputValue": "2/24/2020 23:59:00",
				"numericValue": "43885.99930555555",
				"$t": "2020/02/24 23:59"
			}
		}, {
			"id": {
				"$t": "https://spreadsheets.google.com/feeds/cells/1svNxbDR3mKKmLCdcTmMmj2XaI2bl-bA-cSOVQOO_zaM/1/public/full/R24C1"
			},
			"updated": {
				"$t": "2020-05-13T13:59:08.728Z"
			},
			"category": [{
				"scheme": "http://schemas.google.com/spreadsheets/2006",
				"term": "http://schemas.google.com/spreadsheets/2006#cell"
			}],
			"title": {
				"type": "text",
				"$t": "A24"
			},
			"content": {
				"type": "text",
				"$t": "IS"
			},
			"link": [{
				"rel": "self",
				"type": "application/atom+xml",
				"href": "https://spreadsheets.google.com/feeds/cells/1svNxbDR3mKKmLCdcTmMmj2XaI2bl-bA-cSOVQOO_zaM/1/public/full/R24C1"
			}],
			"gs$cell": {
				"row": "24",
				"col": "1",
				"inputValue": "IS",
				"$t": "IS"
			}
		}, {
			"id": {
				"$t": "https://spreadsheets.google.com/feeds/cells/1svNxbDR3mKKmLCdcTmMmj2XaI2bl-bA-cSOVQOO_zaM/1/public/full/R24C2"
			},
			"updated": {
				"$t": "2020-05-13T13:59:08.728Z"
			},
			"category": [{
				"scheme": "http://schemas.google.com/spreadsheets/2006",
				"term": "http://schemas.google.com/spreadsheets/2006#cell"
			}],
			"title": {
				"type": "text",
				"$t": "B24"
			},
			"content": {
				"type": "text",
				"$t": "Case B"
			},
			"link": [{
				"rel": "self",
				"type": "application/atom+xml",
				"href": "https://spreadsheets.google.com/feeds/cells/1svNxbDR3mKKmLCdcTmMmj2XaI2bl-bA-cSOVQOO_zaM/1/public/full/R24C2"
			}],
			"gs$cell": {
				"row": "24",
				"col": "2",
				"inputValue": "Case B",
				"$t": "Case B"
			}
		}, {
			"id": {
				"$t": "https://spreadsheets.google.com/feeds/cells/1svNxbDR3mKKmLCdcTmMmj2XaI2bl-bA-cSOVQOO_zaM/1/public/full/R24C3"
			},
			"updated": {
				"$t": "2020-05-13T13:59:08.728Z"
			},
			"category": [{
				"scheme": "http://schemas.google.com/spreadsheets/2006",
				"term": "http://schemas.google.com/spreadsheets/2006#cell"
			}],
			"title": {
				"type": "text",
				"$t": "C24"
			},
			"content": {
				"type": "text",
				"$t": "homework"
			},
			"link": [{
				"rel": "self",
				"type": "application/atom+xml",
				"href": "https://spreadsheets.google.com/feeds/cells/1svNxbDR3mKKmLCdcTmMmj2XaI2bl-bA-cSOVQOO_zaM/1/public/full/R24C3"
			}],
			"gs$cell": {
				"row": "24",
				"col": "3",
				"inputValue": "homework",
				"$t": "homework"
			}
		}, {
			"id": {
				"$t": "https://spreadsheets.google.com/feeds/cells/1svNxbDR3mKKmLCdcTmMmj2XaI2bl-bA-cSOVQOO_zaM/1/public/full/R24C4"
			},
			"updated": {
				"$t": "2020-05-13T13:59:08.728Z"
			},
			"category": [{
				"scheme": "http://schemas.google.com/spreadsheets/2006",
				"term": "http://schemas.google.com/spreadsheets/2006#cell"
			}],
			"title": {
				"type": "text",
				"$t": "D24"
			},
			"content": {
				"type": "text",
				"$t": "https://ulisboa-my.sharepoint.com/:f:/r/personal/ist197096_tecnico_ulisboa_pt/Documents/ISM/cases/cB_2020_02_29?csf\u003d1\u0026e\u003dr40xu7"
			},
			"link": [{
				"rel": "self",
				"type": "application/atom+xml",
				"href": "https://spreadsheets.google.com/feeds/cells/1svNxbDR3mKKmLCdcTmMmj2XaI2bl-bA-cSOVQOO_zaM/1/public/full/R24C4"
			}],
			"gs$cell": {
				"row": "24",
				"col": "4",
				"inputValue": "https://ulisboa-my.sharepoint.com/:f:/r/personal/ist197096_tecnico_ulisboa_pt/Documents/ISM/cases/cB_2020_02_29?csf\u003d1\u0026e\u003dr40xu7",
				"$t": "https://ulisboa-my.sharepoint.com/:f:/r/personal/ist197096_tecnico_ulisboa_pt/Documents/ISM/cases/cB_2020_02_29?csf\u003d1\u0026e\u003dr40xu7"
			}
		}, {
			"id": {
				"$t": "https://spreadsheets.google.com/feeds/cells/1svNxbDR3mKKmLCdcTmMmj2XaI2bl-bA-cSOVQOO_zaM/1/public/full/R24C5"
			},
			"updated": {
				"$t": "2020-05-13T13:59:08.728Z"
			},
			"category": [{
				"scheme": "http://schemas.google.com/spreadsheets/2006",
				"term": "http://schemas.google.com/spreadsheets/2006#cell"
			}],
			"title": {
				"type": "text",
				"$t": "E24"
			},
			"content": {
				"type": "text",
				"$t": "2020/02/24 13:00"
			},
			"link": [{
				"rel": "self",
				"type": "application/atom+xml",
				"href": "https://spreadsheets.google.com/feeds/cells/1svNxbDR3mKKmLCdcTmMmj2XaI2bl-bA-cSOVQOO_zaM/1/public/full/R24C5"
			}],
			"gs$cell": {
				"row": "24",
				"col": "5",
				"inputValue": "2/24/2020 13:00:00",
				"numericValue": "43885.541666666664",
				"$t": "2020/02/24 13:00"
			}
		}, {
			"id": {
				"$t": "https://spreadsheets.google.com/feeds/cells/1svNxbDR3mKKmLCdcTmMmj2XaI2bl-bA-cSOVQOO_zaM/1/public/full/R24C6"
			},
			"updated": {
				"$t": "2020-05-13T13:59:08.728Z"
			},
			"category": [{
				"scheme": "http://schemas.google.com/spreadsheets/2006",
				"term": "http://schemas.google.com/spreadsheets/2006#cell"
			}],
			"title": {
				"type": "text",
				"$t": "F24"
			},
			"content": {
				"type": "text",
				"$t": "2020/02/29 13:00"
			},
			"link": [{
				"rel": "self",
				"type": "application/atom+xml",
				"href": "https://spreadsheets.google.com/feeds/cells/1svNxbDR3mKKmLCdcTmMmj2XaI2bl-bA-cSOVQOO_zaM/1/public/full/R24C6"
			}],
			"gs$cell": {
				"row": "24",
				"col": "6",
				"inputValue": "2/29/2020 13:00:00",
				"numericValue": "43890.541666666664",
				"$t": "2020/02/29 13:00"
			}
		}, {
			"id": {
				"$t": "https://spreadsheets.google.com/feeds/cells/1svNxbDR3mKKmLCdcTmMmj2XaI2bl-bA-cSOVQOO_zaM/1/public/full/R25C1"
			},
			"updated": {
				"$t": "2020-05-13T13:59:08.728Z"
			},
			"category": [{
				"scheme": "http://schemas.google.com/spreadsheets/2006",
				"term": "http://schemas.google.com/spreadsheets/2006#cell"
			}],
			"title": {
				"type": "text",
				"$t": "A25"
			},
			"content": {
				"type": "text",
				"$t": "IS"
			},
			"link": [{
				"rel": "self",
				"type": "application/atom+xml",
				"href": "https://spreadsheets.google.com/feeds/cells/1svNxbDR3mKKmLCdcTmMmj2XaI2bl-bA-cSOVQOO_zaM/1/public/full/R25C1"
			}],
			"gs$cell": {
				"row": "25",
				"col": "1",
				"inputValue": "IS",
				"$t": "IS"
			}
		}, {
			"id": {
				"$t": "https://spreadsheets.google.com/feeds/cells/1svNxbDR3mKKmLCdcTmMmj2XaI2bl-bA-cSOVQOO_zaM/1/public/full/R25C2"
			},
			"updated": {
				"$t": "2020-05-13T13:59:08.728Z"
			},
			"category": [{
				"scheme": "http://schemas.google.com/spreadsheets/2006",
				"term": "http://schemas.google.com/spreadsheets/2006#cell"
			}],
			"title": {
				"type": "text",
				"$t": "B25"
			},
			"content": {
				"type": "text",
				"$t": "Case B review"
			},
			"link": [{
				"rel": "self",
				"type": "application/atom+xml",
				"href": "https://spreadsheets.google.com/feeds/cells/1svNxbDR3mKKmLCdcTmMmj2XaI2bl-bA-cSOVQOO_zaM/1/public/full/R25C2"
			}],
			"gs$cell": {
				"row": "25",
				"col": "2",
				"inputValue": "Case B review",
				"$t": "Case B review"
			}
		}, {
			"id": {
				"$t": "https://spreadsheets.google.com/feeds/cells/1svNxbDR3mKKmLCdcTmMmj2XaI2bl-bA-cSOVQOO_zaM/1/public/full/R25C3"
			},
			"updated": {
				"$t": "2020-05-13T13:59:08.728Z"
			},
			"category": [{
				"scheme": "http://schemas.google.com/spreadsheets/2006",
				"term": "http://schemas.google.com/spreadsheets/2006#cell"
			}],
			"title": {
				"type": "text",
				"$t": "C25"
			},
			"content": {
				"type": "text",
				"$t": "homework"
			},
			"link": [{
				"rel": "self",
				"type": "application/atom+xml",
				"href": "https://spreadsheets.google.com/feeds/cells/1svNxbDR3mKKmLCdcTmMmj2XaI2bl-bA-cSOVQOO_zaM/1/public/full/R25C3"
			}],
			"gs$cell": {
				"row": "25",
				"col": "3",
				"inputValue": "homework",
				"$t": "homework"
			}
		}, {
			"id": {
				"$t": "https://spreadsheets.google.com/feeds/cells/1svNxbDR3mKKmLCdcTmMmj2XaI2bl-bA-cSOVQOO_zaM/1/public/full/R25C4"
			},
			"updated": {
				"$t": "2020-05-13T13:59:08.728Z"
			},
			"category": [{
				"scheme": "http://schemas.google.com/spreadsheets/2006",
				"term": "http://schemas.google.com/spreadsheets/2006#cell"
			}],
			"title": {
				"type": "text",
				"$t": "D25"
			},
			"content": {
				"type": "text",
				"$t": "https://ulisboa-my.sharepoint.com/:f:/r/personal/ist197096_tecnico_ulisboa_pt/Documents/ISM/cases/cB_2020_02_29/reviews?csf\u003d1\u0026e\u003dE8zfxf"
			},
			"link": [{
				"rel": "self",
				"type": "application/atom+xml",
				"href": "https://spreadsheets.google.com/feeds/cells/1svNxbDR3mKKmLCdcTmMmj2XaI2bl-bA-cSOVQOO_zaM/1/public/full/R25C4"
			}],
			"gs$cell": {
				"row": "25",
				"col": "4",
				"inputValue": "https://ulisboa-my.sharepoint.com/:f:/r/personal/ist197096_tecnico_ulisboa_pt/Documents/ISM/cases/cB_2020_02_29/reviews?csf\u003d1\u0026e\u003dE8zfxf",
				"$t": "https://ulisboa-my.sharepoint.com/:f:/r/personal/ist197096_tecnico_ulisboa_pt/Documents/ISM/cases/cB_2020_02_29/reviews?csf\u003d1\u0026e\u003dE8zfxf"
			}
		}, {
			"id": {
				"$t": "https://spreadsheets.google.com/feeds/cells/1svNxbDR3mKKmLCdcTmMmj2XaI2bl-bA-cSOVQOO_zaM/1/public/full/R25C5"
			},
			"updated": {
				"$t": "2020-05-13T13:59:08.728Z"
			},
			"category": [{
				"scheme": "http://schemas.google.com/spreadsheets/2006",
				"term": "http://schemas.google.com/spreadsheets/2006#cell"
			}],
			"title": {
				"type": "text",
				"$t": "E25"
			},
			"content": {
				"type": "text",
				"$t": "2020/03/01 8:00"
			},
			"link": [{
				"rel": "self",
				"type": "application/atom+xml",
				"href": "https://spreadsheets.google.com/feeds/cells/1svNxbDR3mKKmLCdcTmMmj2XaI2bl-bA-cSOVQOO_zaM/1/public/full/R25C5"
			}],
			"gs$cell": {
				"row": "25",
				"col": "5",
				"inputValue": "3/1/2020 8:00:00",
				"numericValue": "43891.333333333336",
				"$t": "2020/03/01 8:00"
			}
		}, {
			"id": {
				"$t": "https://spreadsheets.google.com/feeds/cells/1svNxbDR3mKKmLCdcTmMmj2XaI2bl-bA-cSOVQOO_zaM/1/public/full/R25C6"
			},
			"updated": {
				"$t": "2020-05-13T13:59:08.728Z"
			},
			"category": [{
				"scheme": "http://schemas.google.com/spreadsheets/2006",
				"term": "http://schemas.google.com/spreadsheets/2006#cell"
			}],
			"title": {
				"type": "text",
				"$t": "F25"
			},
			"content": {
				"type": "text",
				"$t": "2020/03/02 13:00"
			},
			"link": [{
				"rel": "self",
				"type": "application/atom+xml",
				"href": "https://spreadsheets.google.com/feeds/cells/1svNxbDR3mKKmLCdcTmMmj2XaI2bl-bA-cSOVQOO_zaM/1/public/full/R25C6"
			}],
			"gs$cell": {
				"row": "25",
				"col": "6",
				"inputValue": "3/2/2020 13:00:00",
				"numericValue": "43892.541666666664",
				"$t": "2020/03/02 13:00"
			}
		}, {
			"id": {
				"$t": "https://spreadsheets.google.com/feeds/cells/1svNxbDR3mKKmLCdcTmMmj2XaI2bl-bA-cSOVQOO_zaM/1/public/full/R26C1"
			},
			"updated": {
				"$t": "2020-05-13T13:59:08.728Z"
			},
			"category": [{
				"scheme": "http://schemas.google.com/spreadsheets/2006",
				"term": "http://schemas.google.com/spreadsheets/2006#cell"
			}],
			"title": {
				"type": "text",
				"$t": "A26"
			},
			"content": {
				"type": "text",
				"$t": "IS"
			},
			"link": [{
				"rel": "self",
				"type": "application/atom+xml",
				"href": "https://spreadsheets.google.com/feeds/cells/1svNxbDR3mKKmLCdcTmMmj2XaI2bl-bA-cSOVQOO_zaM/1/public/full/R26C1"
			}],
			"gs$cell": {
				"row": "26",
				"col": "1",
				"inputValue": "IS",
				"$t": "IS"
			}
		}, {
			"id": {
				"$t": "https://spreadsheets.google.com/feeds/cells/1svNxbDR3mKKmLCdcTmMmj2XaI2bl-bA-cSOVQOO_zaM/1/public/full/R26C2"
			},
			"updated": {
				"$t": "2020-05-13T13:59:08.728Z"
			},
			"category": [{
				"scheme": "http://schemas.google.com/spreadsheets/2006",
				"term": "http://schemas.google.com/spreadsheets/2006#cell"
			}],
			"title": {
				"type": "text",
				"$t": "B26"
			},
			"content": {
				"type": "text",
				"$t": "Case C"
			},
			"link": [{
				"rel": "self",
				"type": "application/atom+xml",
				"href": "https://spreadsheets.google.com/feeds/cells/1svNxbDR3mKKmLCdcTmMmj2XaI2bl-bA-cSOVQOO_zaM/1/public/full/R26C2"
			}],
			"gs$cell": {
				"row": "26",
				"col": "2",
				"inputValue": "Case C",
				"$t": "Case C"
			}
		}, {
			"id": {
				"$t": "https://spreadsheets.google.com/feeds/cells/1svNxbDR3mKKmLCdcTmMmj2XaI2bl-bA-cSOVQOO_zaM/1/public/full/R26C3"
			},
			"updated": {
				"$t": "2020-05-13T13:59:08.728Z"
			},
			"category": [{
				"scheme": "http://schemas.google.com/spreadsheets/2006",
				"term": "http://schemas.google.com/spreadsheets/2006#cell"
			}],
			"title": {
				"type": "text",
				"$t": "C26"
			},
			"content": {
				"type": "text",
				"$t": "homework"
			},
			"link": [{
				"rel": "self",
				"type": "application/atom+xml",
				"href": "https://spreadsheets.google.com/feeds/cells/1svNxbDR3mKKmLCdcTmMmj2XaI2bl-bA-cSOVQOO_zaM/1/public/full/R26C3"
			}],
			"gs$cell": {
				"row": "26",
				"col": "3",
				"inputValue": "homework",
				"$t": "homework"
			}
		}, {
			"id": {
